ID,Nombre,Precio,Link,Imagen_Base,Descripcion,Galeria_Fotos,Info_Variantes
2109,Tinta Acrílica Emborrachada Fundo e Acabamento Ciaflex Ciacollor 20kg,402.14,http://www.mercotintas.com.br/tintas-e-complementos/tinta-acrilica-emborrachada-ciacollor-20kg,https://images.tcdn.com.br/img/img_prod/1139809/tinta_acrilica_emborrachada_ciacollor_20kg_2109_1_9f894b5ff4fccf9f785014ad04918a0f.png,"<div class=""tab rte description-ab active"" id=""descricao""><div style=""text-align: justify;""><div style=""text-align: justify;""><h3 style=""text-align: justify;""><span style=""color: rgb(0, 0, 0);""><span style=""font-family: verdana, geneva, sans-serif;""><span style=""font-size: 16px;""><strong>Ciaflex Fundo e Acabamento Ciacollor</strong></span></span></span></h3><p style=""text-align: justify;""><span style=""color: rgb(0, 0, 0);""><span style=""font-family: verdana, geneva, sans-serif;""><span style=""font-size: 16px;"">O Ciaflex Fundo e Acabamento Ciacollor é um produto de alta performance, ideal para proteger paredes de alvenaria e telhados metálicos. Com excelente elasticidade e cobertura, corrige e previne microfissuras de até 0,3 mm. Além disso, reduz o ruído em telhados e melhora o conforto térmico, podendo diminuir até 15°C na temperatura de superfícies galvanizadas e proporcionar até 3°C de conforto térmico adicional no ambiente.</span></span></span></p><h3 style=""text-align: justify;""><span style=""color: rgb(0, 0, 0);""><span style=""font-family: verdana, geneva, sans-serif;""><span style=""font-size: 16px;""><strong>Características e Benefícios</strong></span></span></span></h3><p style=""text-align: justify;""><span style=""color: rgb(0, 0, 0);""><span style=""font-family: verdana, geneva, sans-serif;""><span style=""font-size: 16px;"">✔ Alta elasticidade – Previne e corrige microfissuras.<br/>✔ Conforto térmico – Redução da temperatura em superfícies galvanizadas.<br/>✔ Redução de ruído – Melhora o conforto acústico em telhados.<br/>✔ Ótima aderência – Ideal para alvenaria e telhados metálicos.</span></span></span></p><h3 style=""text-align: justify;""><span style=""color: rgb(0, 0, 0);""><span style=""font-family: verdana, geneva, sans-serif;""><span style=""font-size: 16px;""><strong>Rendimento</strong></span></span></span></h3><p style=""text-align: justify;""><span style=""color: rgb(0, 0, 0);""><span style=""font-family: verdana, geneva, sans-serif;""><span style=""font-size: 16px;"">900g: 5 a 10 m² por demão<br/>3,6Kg: 20 a 40 m² por demão<br/>18Kg: 100 a 200 m² por demão<br/>20Kg: 110 a 220 m² por demão</span></span></span></p><h3 style=""text-align: justify;""><span style=""color: rgb(0, 0, 0);""><span style=""font-family: verdana, geneva, sans-serif;""><span style=""font-size: 16px;""><strong>Tempo de Secagem</strong></span></span></span></h3><p style=""text-align: justify;""><span style=""color: rgb(0, 0, 0);""><span style=""font-family: verdana, geneva, sans-serif;""><span style=""font-size: 16px;"">Ao toque: 1 hora<br/>Entre demãos: 4 horas<br/>Final: 72 horas</span></span></span></p><h3 style=""text-align: justify;""><span style=""color: rgb(0, 0, 0);""><span style=""font-family: verdana, geneva, sans-serif;""><span style=""font-size: 16px;""><strong>Modo de Aplicação</strong></span></span></span></h3><p style=""text-align: justify;""><span style=""color: rgb(0, 0, 0);""><span style=""font-family: verdana, geneva, sans-serif;""><span style=""font-size: 16px;"">Diluição: Até 10% com água potável.<br/>Demãos: 4 a 6 camadas para paredes e 3 a 4 camadas para telhados.<br/>Ferramentas: Rolo, trincha ou pistola.</span></span></span></p><p style=""text-align: justify;""><span style=""color: rgb(0, 0, 0);""><span style=""font-family: verdana, geneva, sans-serif;""><span style=""font-size: 16px;"">Garanta proteção, conforto térmico e durabilidade com o<strong> Ciaflex Fundo e Acabamento Ciacollor!</strong></span></span></span></p></div></div></div>",https://images.tcdn.com.br/img/img_prod/1139809/tinta_acrilica_emborrachada_fundo_e_acabamento_ciaflex_ciacollor_20kg_2109_2_ed3bb430bc807e60499239b8326b5001.png | https://images.tcdn.com.br/img/img_prod/1139809/tinta_acrilica_emborrachada_fundo_e_acabamento_ciaflex_ciacollor_20kg_2109_3_5d9a61a596f964a73f6842aed9583646.png | https://images.tcdn.com.br/img/img_prod/1139809/tinta_acrilica_emborrachada_ciacollor_20kg_2109_1_9f894b5ff4fccf9f785014ad04918a0f.png | https://images.tcdn.com.br/img/img_prod/1139809/90_tinta_acrilica_emborrachada_ciacollor_20kg_2109_1_9f894b5ff4fccf9f785014ad04918a0f.png | https://images.tcdn.com.br/img/img_prod/1139809/90_tinta_acrilica_emborrachada_fundo_e_acabamento_ciaflex_ciacollor_20kg_2109_3_5d9a61a596f964a73f6842aed9583646.png | https://images.tcdn.com.br/img/img_prod/1139809/90_tinta_acrilica_emborrachada_fundo_e_acabamento_ciaflex_ciacollor_20kg_2109_2_ed3bb430bc807e60499239b8326b5001.png,Cor: Elefante [R$503.26] (Stock:SI) | Cor: Areia [R$503.26] (Stock:SI) | Cor: Camurça [R$503.26] (Stock:SI) | Cor: Cinza Arame [R$533.48] (Stock:SI) | Cor: Concreto [R$503.26] (Stock:SI) | Cor: Branco Gelo [R$503.26] (Stock:SI) | Cor: Marrom Trufa [R$503.27] (Stock:NO) | Cor: Palha [R$503.29] (Stock:NO) | Cor: Prata Fina [R$533.48] (Stock:SI) | Cor: Preto [R$402.14] (Stock:SI) | Cor: Tabaco [R$503.29] (Stock:SI) | Cor: Verde Nilo [R$402.15] (Stock:NO)
2073,Tinta Acrílica Econômica Profissional Fosco Ciacollor 16lt,147.11,http://www.mercotintas.com.br/tintas/tintas-imobiliarias/tinta-acrilica-economica-profissional-fosco-ciacollor-16-l,https://images.tcdn.com.br/img/img_prod/1139809/tinta_acrilica_economica_profissional_fosco_ciacollor_16_l_2073_1_eb2c72aea432510f9efe1220835a3c46.png,"<div class=""tab rte description-ab active"" id=""descricao""><p><span style=""color:#000000;""><span style=""font-size:16px;""><span style=""font-family:verdana,geneva,sans-serif;""><strong>Tinta Acrílica Econômica Profissional Fosco Ciacollor</strong> </span></span></span></p><p><span style=""color:#000000;""><span style=""font-size:16px;""><span style=""font-family:verdana,geneva,sans-serif;"">Perfeita para quem busca renovar ambientes com um toque moderno e econômico. Essa tinta é ideal para diferentes superfícies, oferecendo um acabamento fosco e uniforme que valoriza qualquer espaço.</span></span></span></p><p> </p><p><span style=""color:#000000;""><span style=""font-size:16px;""><span style=""font-family:verdana,geneva,sans-serif;""><strong>Como preparar a superfície</strong> </span></span></span></p><p><span style=""color:#000000;""><span style=""font-size:16px;""><span style=""font-family:verdana,geneva,sans-serif;"">Antes de aplicar a Tinta Acrílica Econômica Profissional Fosco Ciacollor, certifique-se de que a área esteja limpa, seca e sem poeira. Se houver manchas de gordura, lave com água e detergente; para mofo, utilize uma solução com hipoclorito, enxágue e deixe secar bem. Superfícies com brilho devem ser lixadas para garantir melhor aderência.</span></span></span></p><p> </p><p><span style=""color:#000000;""><span style=""font-size:16px;""><span style=""font-family:verdana,geneva,sans-serif;""><strong>Aplicação</strong> </span></span></span></p><p><span style=""color:#000000;""><span style=""font-size:16px;""><span style=""font-family:verdana,geneva,sans-serif;"">A tinta já vem pronta para uso, mas, se preferir, dilua levemente com água para facilitar a aplicação. Para melhores resultados, aplique de 2 a 3 demãos, com intervalos de cerca de 4 horas entre elas.</span></span></span></p><p> </p><p><span style=""color:#000000;""><span style=""font-size:16px;""><span style=""font-family:verdana,geneva,sans-serif;""><strong>Ferramentas</strong> </span></span></span></p><p><span style=""color:#000000;""><span style=""font-size:16px;""><span style=""font-family:verdana,geneva,sans-serif;"">U</span></span></span><span style=""font-family: verdana, geneva, sans-serif; font-size: 16px; color: rgb(0, 0, 0);"">se rolo, pincel ou pistola de pintura, conforme sua preferência.</span></p><p> </p><p><span style=""color:#000000;""><span style=""font-size:16px;""><span style=""font-family:verdana,geneva,sans-serif;""><strong>Rendimento e secagem</strong> </span></span></span></p><p><span style=""color:#000000;""><span style=""font-size:16px;""><span style=""font-family:verdana,geneva,sans-serif;"">Um galão de 3,6 litros cobre até 14 m² e um balde de 16 litros rende até 63 m², dependendo da superfície e técnica aplicada. A tinta seca ao toque em 1 hora e atinge a secagem completa em até 72 horas.</span></span></span></p><p> </p><p><span style=""color:#000000;""><span style=""font-size:16px;""><span style=""font-family:verdana,geneva,sans-serif;"">Com a <strong>Tinta Acrílica Econômica Profissional Fosco Ciacollor</strong>, você transforma seus ambientes de forma prática e eficiente, com um acabamento duradouro e de alta qualidade.</span></span></span></p></div>",https://images.tcdn.com.br/img/img_prod/1139809/tinta_acrilica_economica_profissional_fosco_ciacollor_16lt_2073_4_7e1964765b31821dd39b80e4cb313062.png | https://images.tcdn.com.br/img/img_prod/1139809/90_tinta_acrilica_economica_profissional_fosco_ciacollor_16lt_2073_4_7e1964765b31821dd39b80e4cb313062.png | https://images.tcdn.com.br/img/img_prod/1139809/tinta_acrilica_economica_profissional_fosco_ciacollor_16lt_2073_2_ea650e0bf1f9aeb6033a31283ec289a8.png | https://images.tcdn.com.br/img/img_prod/1139809/90_tinta_acrilica_economica_profissional_fosco_ciacollor_16lt_2073_3_4903fe5b279198f5cf78fc97313fdba0.png | https://images.tcdn.com.br/img/img_prod/1139809/tinta_acrilica_economica_profissional_fosco_ciacollor_16_l_2073_1_eb2c72aea432510f9efe1220835a3c46.png | https://images.tcdn.com.br/img/img_prod/1139809/90_tinta_acrilica_economica_profissional_fosco_ciacollor_16_l_2073_1_eb2c72aea432510f9efe1220835a3c46.png | https://images.tcdn.com.br/img/img_prod/1139809/90_tinta_acrilica_economica_profissional_fosco_ciacollor_16lt_2073_2_ea650e0bf1f9aeb6033a31283ec289a8.png | https://images.tcdn.com.br/img/img_prod/1139809/tinta_acrilica_economica_profissional_fosco_ciacollor_16lt_2073_3_4903fe5b279198f5cf78fc97313fdba0.png,Cor: Elefante [R$168.81] (Stock:SI) | Cor: Amarelo Canário [R$154.62] (Stock:SI) | Cor: Amarelo Ouro [R$168.81] (Stock:SI) | Cor: Areia [R$168.81] (Stock:SI) | Cor: Azul Oceano [R$168.81] (Stock:NO) | Cor: Azul Sereno [R$163.88] (Stock:SI) | Cor: Camurça [R$168.81] (Stock:NO) | Cor: Cinza Arame [R$168.81] (Stock:SI) | Cor: Erva Doce [R$163.89] (Stock:SI) | Cor: Laranja [R$168.81] (Stock:SI) | Cor: Marfim [R$168.81] (Stock:SI) | Cor: Palha [R$147.11] (Stock:NO) | Cor: Prata Fina [R$168.81] (Stock:SI) | Cor: Pêssego [R$162.65] (Stock:SI) | Cor: Perola [R$159.23] (Stock:NO) | Cor: Tabaco [R$168.81] (Stock:SI) | Cor: Verde Limão [R$168.81] (Stock:NO) | Cor: Branco Neve [R$168.81] (Stock:NO) | Cor: Vermelho [R$170.8] (Stock:SI)
2077,Tinta Acrílica Performance Fosco Ciacollor 18lt,212.14,http://www.mercotintas.com.br/tintas/tintas-imobiliarias/tinta-acrilica-performance-fosco-ciacollor-18-l,https://images.tcdn.com.br/img/img_prod/1139809/tinta_acrilica_performance_fosco_ciacollor_18_l_2077_1_e92923bc7a843f1b026f1a1bec844bd4.png,"<div class=""tab rte description-ab active"" id=""descricao""><h3><span style=""color:#000000;""><span style=""font-size:16px;""><span style=""font-family:verdana,geneva,sans-serif;""><strong>Tinta Acrílica Performance Standard Fosco – Ciacollor</strong></span></span></span></h3><p><span style=""color:#000000;""><span style=""font-size:16px;""><span style=""font-family:verdana,geneva,sans-serif;"">A Tinta Acrílica Performance Standard Fosco Ciacollor é ideal para pintura de áreas internas e externas, oferecendo acabamento de qualidade e alta performance em superfícies de alvenaria, reboco, fibrocimento, concreto e gesso. Disponível em cores prontas e também no sistema tintométrico Ciasystem, atende às normas NBR 11702 tipo 4.5.2 e NBR 15.079, garantindo um produto confiável e durável.</span></span></span></p><h3><span style=""color:#000000;""><span style=""font-size:16px;""><span style=""font-family:verdana,geneva,sans-serif;""><strong>Principais Benefícios</strong></span></span></span></h3><p><span style=""color:#000000;""><span style=""font-size:16px;""><span style=""font-family:verdana,geneva,sans-serif;"">✔ Acabamento fosco de qualidade<br/>✔ Para ambientes internos e externos<br/>✔ Ótima aderência e resistência<br/>✔ Disponível em cores prontas e no sistema tintométrico</span></span></span></p><h3><span style=""color:#000000;""><span style=""font-size:16px;""><span style=""font-family:verdana,geneva,sans-serif;""><strong>Rendimento</strong></span></span></span></h3><p><span style=""color:#000000;""><span style=""font-size:16px;""><span style=""font-family:verdana,geneva,sans-serif;""><strong>3,6 L</strong> → até <strong>18 m²</strong> (cores de linha)<br/><strong>18 L</strong> → até <strong>90 m²</strong> (cores de linha)<br/><em>O rendimento pode variar conforme a superfície e o método de aplicação.</em></span></span></span></p><h3><span style=""color:#000000;""><span style=""font-size:16px;""><span style=""font-family:verdana,geneva,sans-serif;""><strong>Modo de Aplicação</strong></span></span></span></h3><p><span style=""color:#000000;""><span style=""font-size:16px;""><span style=""font-family:verdana,geneva,sans-serif;"">Demãos: 2 a 3 (podendo variar conforme a superfície e a cor escolhida).<br/>Diluição: 1ª demão: 20% de água limpa. 2ª e 3ª demãos: 10% de água limpa.<br/>Ferramentas: Rolo de lã de pelo baixo, trincha, pincel de cerdas macias ou pistola.</span></span></span></p><h3><span style=""color:#000000;""><span style=""font-size:16px;""><span style=""font-family:verdana,geneva,sans-serif;""><strong>Preparo da Superfície</strong></span></span></span></h3><p><span style=""color:#000000;""><span style=""font-size:16px;""><span style=""font-family:verdana,geneva,sans-serif;"">Superfície limpa e seca: Livre de poeira, gordura e sujeira.<br/>Superfície com mofo: Misture água e hipoclorito (1:1), deixe agir por 6 horas, enxágue e aguarde 24 horas antes de pintar.<br/>Superfície brilhante: Lixe e limpe antes da aplicação.<br/>Reboco fraco ou caiação: Remova partes soltas, lixe e aplique Fundo Preparador de Paredes Ciacollor.<br/>Imperfeições: Corrija com Massa Acrílica (para áreas externas) ou Massa Corrida (para áreas internas).<br/>Reboco novo: Aguarde 30 dias de cura antes de aplicar o Selador Acrílico Ciacollor.<br/><em>Não aplique sobre superfícies úmidas, enceradas, esmaltadas ou vitrificadas.</em></span></span></span></p><h3><span style=""color:#000000;""><span style=""font-size:16px;""><span style=""font-family:verdana,geneva,sans-serif;""><strong>Tempo de Secagem</strong></span></span></span></h3><p><span style=""color:#000000;""><span style=""font-size:16px;""><span style=""font-family:verdana,geneva,sans-serif;"">Ao toque: 1 hora<br/>Entre demãos: 4 horas<br/>Secagem final: 72 horas</span></span></span></p><p><span style=""color:#000000;""><span style=""font-size:16px;""><span style=""font-family:verdana,geneva,sans-serif;""><em>O tempo pode variar conforme as condições climáticas.</em></span></span></span></p><p><span style=""color:#000000;""><span style=""font-size:16px;""><span style=""font-family:verdana,geneva,sans-serif;"">Garanta um acabamento impecável e proteção duradoura com a<strong> Tinta Acrílica Performance Standard Fosco Ciacollor</strong>! </span></span></span></p></div>",https://images.tcdn.com.br/img/img_prod/1139809/90_tinta_acrilica_performance_fosco_ciacollor_18lt_2077_4_7e1964765b31821dd39b80e4cb313062.png | https://images.tcdn.com.br/img/img_prod/1139809/tinta_acrilica_performance_fosco_ciacollor_18_l_2077_1_e92923bc7a843f1b026f1a1bec844bd4.png | https://images.tcdn.com.br/img/img_prod/1139809/90_tinta_acrilica_performance_fosco_ciacollor_18lt_2077_2_ea650e0bf1f9aeb6033a31283ec289a8.png | https://images.tcdn.com.br/img/img_prod/1139809/tinta_acrilica_performance_fosco_ciacollor_18lt_2077_4_7e1964765b31821dd39b80e4cb313062.png | https://images.tcdn.com.br/img/img_prod/1139809/90_tinta_acrilica_performance_fosco_ciacollor_18lt_2077_3_4903fe5b279198f5cf78fc97313fdba0.png | https://images.tcdn.com.br/img/img_prod/1139809/90_tinta_acrilica_performance_fosco_ciacollor_18_l_2077_1_e92923bc7a843f1b026f1a1bec844bd4.png | https://images.tcdn.com.br/img/img_prod/1139809/tinta_acrilica_performance_fosco_ciacollor_18lt_2077_2_ea650e0bf1f9aeb6033a31283ec289a8.png | https://images.tcdn.com.br/img/img_prod/1139809/tinta_acrilica_performance_fosco_ciacollor_18lt_2077_3_4903fe5b279198f5cf78fc97313fdba0.png,Cor: Elefante [R$326.81] (Stock:SI) | Cor: Branco Neve [R$326.82] (Stock:SI) | Cor: Pimenta de Cheiro [R$298.83] (Stock:SI) | Cor: Bianco Sereno [R$233.41] (Stock:NO) | Cor: Pêssego [R$326.82] (Stock:SI) | Cor: Verde Kiwi [R$326.82] (Stock:SI) | Cor: Orquídea [R$295.77] (Stock:SI) | Cor: Rosa Açaí [R$255.92] (Stock:SI) | Cor: Marfim [R$323.2] (Stock:NO) | Cor: Perola [R$308.31] (Stock:NO) | Cor: Amarelo Canário [R$212.14] (Stock:SI) | Cor: Laranja [R$326.81] (Stock:SI) | Cor: Verde Limão [R$212.14] (Stock:NO) | Cor: Erva Doce [R$323.2] (Stock:SI) | Cor: Amarelo Ouro [R$326.82] (Stock:SI) | Cor: Azul Oceano [R$326.81] (Stock:SI) | Cor: Vermelho [R$304.93] (Stock:SI) | Cor: Azul Sereno [R$233.45] (Stock:NO) | Cor: Cinza Arame [R$326.82] (Stock:SI) | Cor: Palha [R$326.82] (Stock:NO) | Cor: Prata Fina [R$326.82] (Stock:NO) | Cor: Tabaco [R$319] (Stock:SI) | Cor: Areia [R$326.82] (Stock:SI) | Cor: Camurça [R$326.82] (Stock:SI) | Cor: Branco Gelo [R$326.82] (Stock:SI)
2163,Resina Eco Base Água Ciacollor 18lt,213.55,http://www.mercotintas.com.br/linha-imobiliaria/resina-eco-base-agua-ciacollor-18lt,https://images.tcdn.com.br/img/img_prod/1139809/resina_eco_base_agua_ciacollor_18lt_2163_1_07cf08ae947eeb1503faa3b0f69ab87f.png,"<div class=""tab rte description-ab active"" id=""descricao""><p><span ""apple="""" ""helvetica="""" ""noto="""" ""segoe="""" 14px;""="""" arial,="""" color="""" emoji"",="""" emoji"";="""" font-size:="""" neue"",="""" roboto,="""" sans"",="""" sans-serif,="""" segoe="""" style=""color: rgb(33, 37, 41); font-family: Montserrat, -apple-system, BlinkMacSystemFont, "" symbol"",="""" ui="""" ui"",="""">É uma resina acrílica brilhante a base de água que tem como características baixo odor, facilidade de aplicação, baixo VOC e excelente resistência à água indicada para aplicação em telhas cerâmicas, de concreto, de amianto, tijolos à vista e concreto aparente. Este produto segue classificação da norma NBR 11702 tipo 4.8.5.</span></p></div>",https://images.tcdn.com.br/img/img_prod/1139809/resina_eco_base_agua_ciacollor_18lt_2163_1_07cf08ae947eeb1503faa3b0f69ab87f.png | https://images.tcdn.com.br/img/img_prod/1139809/90_resina_eco_base_agua_ciacollor_18lt_2163_1_07cf08ae947eeb1503faa3b0f69ab87f.png | https://images.tcdn.com.br/img/img_prod/1139809/90_resina_eco_base_agua_ciacollor_18lt_2163_2_44e6d8d52853fcfb6ba0000f7bd76723.jpeg | https://images.tcdn.com.br/img/img_prod/1139809/resina_eco_base_agua_ciacollor_18lt_2163_2_44e6d8d52853fcfb6ba0000f7bd76723.jpeg,Cor: Branco [R$285.07] (Stock:SI) | Cor: Caramelo [R$213.55] (Stock:SI) | Cor: Cerâmica [R$299.31] (Stock:NO) | Cor: Concreto [R$307.61] (Stock:NO)
2153,Selador Emborrachado Ciaflex Ciacollor 18kg,220.22,http://www.mercotintas.com.br/linha-imobiliaria/selador-acrilico-emborrachado-ciaflex-ciacollor-18kg,https://images.tcdn.com.br/img/img_prod/1139809/selador_acrilico_emborrachado_ciaflex_ciacollor_18kg_2153_1_55e772bde97e5640dd2494a08dd9dac4.png,"<div class=""tab rte description-ab active"" id=""descricao""><p><span style=""font-size:14px;""><span style=""font-family:verdana,geneva,sans-serif;""><strong>O Selador Emborrachado Ciaflex </strong>É um selador emborrachado acrílico indicado para aplicação em paredes de alvenaria que confere bom poder de enchimento e aderência ao substrato. </span></span></p><p> </p><p><span style=""font-size:16px;""><strong><span style=""font-family:verdana,geneva,sans-serif;"">PREPARAÇÃO DA SUPERFÍCIE / INSTRUÇÕES DE USO </span></strong></span></p><p><span style=""font-size:14px;""><span style=""font-family:verdana,geneva,sans-serif;""><strong>Geral:</strong> Toda superfície deve estar devidamente limpa, porosa e seca, isenta de pó ou qualquer outro tipo de sujeira. Em caso de superfícies engorduradas ou com graxa, remover primeiramente a sujeira com água e detergente. Em superfícies mofadas, aplicar solução de água e hipoclorito de sódio na proporção de uma parte de água para uma parte de hipoclorito de sódio e enxaguar após 6 horas. Aplicar o impermeabilizante após no mínimo 24 horas de secagem. Superfícies que possuem brilho devem ser lixadas e limpas antes da aplicação do acabamento. </span></span></p><p><span style=""font-size:14px;""><span style=""font-family:verdana,geneva,sans-serif;""><strong>Reboco Novo: </strong>Após 28 dias de cura do reboco, aplicar de 1 a 2 demãos do Selador Ciaflex, respeitando o intervalo de secagem e diluição indicados na embalagem. </span></span></p><p><span style=""font-size:14px;""><span style=""font-family:verdana,geneva,sans-serif;""><strong>Reboco fraco ou caiação:</strong> proceder a remoção das partes soltas, lixar e aplicar o fundo preparador de paredes Ciacollor. Em alguns casos se faz necessário o uso de massa acrílica (exterior) ou massa corrida (interior) para correção da superfície antes da aplicação do impermeabilizante. </span></span></p><p><span style=""font-size:14px;""><span style=""font-family:verdana,geneva,sans-serif;""><strong>Microfissuras:</strong> para prevenção e correção, aplicar de 4 a 6 demãos cruzadas de Selador Ciaflex e aguardar pelo menos 24 horas para aplicação de Tinta Acrílica.</span></span></p><p><span style=""font-size:14px;""><span style=""font-family:verdana,geneva,sans-serif;""><strong>OBS:</strong> Se for aplicar o Selador Ciaflex como fundo para aplicação posterior de Textura Ciacollor ou Collorgraf, aplicar apenas uma demão do produto. A não observância deste procedimento pode causar problemas futuros.</span></span></p><p> </p><p><span style=""font-size:16px;""><span style=""font-family:verdana,geneva,sans-serif;""><strong>DILUIÇÃO</strong></span></span></p><p><span style=""font-size:14px;""><span style=""font-family:verdana,geneva,sans-serif;"">Todas as camadas: diluir de 10 a 20% com água limpa Antes de iniciar a pintura, mexa o produto novamente para que atinja o ponto ideal para aplicação e rendimento. </span></span></p><p> </p><p><span style=""font-size:16px;""><strong><span style=""font-family:verdana,geneva,sans-serif;"">FERRAMENTAS </span></strong></span></p><p><span style=""font-size:14px;""><span style=""font-family:verdana,geneva,sans-serif;"">Rolo, trincha e pistola. </span></span></p><p> </p><p><span style=""font-size:14px;""><span style=""font-family:verdana,geneva,sans-serif;""><span style=""font-size:16px;""><strong>CAMADAS</strong></span></span></span></p><p><span style=""font-size:14px;""><span style=""font-family:verdana,geneva,sans-serif;"">Paredes de alvenaria: aplicar de 1 a 2 demãos para cobertura do produto. Se utilizado para prevenção e correção de microfissuras deve-se aplicar de 4 a 6 demãos. </span></span></p><p> </p><p><span style=""font-size:16px;""><strong><span style=""font-family:verdana,geneva,sans-serif;"">RENDIMENTO </span></strong></span></p><p><span style=""font-size:14px;""><span style=""font-family:verdana,geneva,sans-serif;"">3,6 Kg: 20 a 40 m² / demão 18 Kg: 100 a 200 m2 / demão </span></span></p><p><span style=""font-size:14px;""><span style=""font-family:verdana,geneva,sans-serif;"">*O rendimento pode sofrer alteração de acordo com a superfície, ferramenta utilizada e experiência do aplicador. </span></span></p><p> </p><p><span style=""font-size:16px;""><strong><span style=""font-family:verdana,geneva,sans-serif;"">SECAGEM </span></strong></span></p><p><span style=""font-size:14px;""><span style=""font-family:verdana,geneva,sans-serif;"">1 hora ao toque, 4 horas entre demãos e 24 horas final. Este tempo pode variar de acordo com as condições climáticas locais no momento da aplicação. </span></span></p></div>",https://images.tcdn.com.br/img/img_prod/1139809/selador_acrilico_emborrachado_ciaflex_ciacollor_18kg_2153_1_55e772bde97e5640dd2494a08dd9dac4.png,
