ID,Nombre,Precio,Link,Imagen_Base,Descripcion,Galeria_Fotos,Info_Variantes
4418,"Revitalizador De Cristais ForteMais 3,6lt",69.99,http://www.mercotintas.com.br/linha-imobiliaria/revitalizador-de-cristais-fortemais-3-6lt,https://images.tcdn.com.br/img/img_prod/1139809/revitalizador_de_cristais_fortemais_3_6lt_4418_1_5eafbfe6e5d95a5583777ccec370b56c.png,"<div class=""tab rte description-ab active"" id=""descricao""><p><span style=""color:#000000;""><span style=""font-size:16px;""><span style=""font-family:verdana,geneva,sans-serif;""><strong>Revitalizador Forte Mais Tintas e Revestimentos Especiais: Renove e Proteja Suas Superfícies com Brilho e Durabilidade!</strong><br/>O Revitalizador Forte Mais Tintas e Revestimentos Especiais é um produto inovador, desenvolvido para restaurar e melhorar a aparência de uma ampla gama de superfícies, tanto internas quanto externas. É ideal para paredes de alvenaria, drywall, reboco, e especialmente eficaz em aplicações de Cristais, Pedras Naturais e Repinturas em geral.</span></span></span></p><p><strong><span style=""color:#000000;""><span style=""font-size:16px;""><span style=""font-family:verdana,geneva,sans-serif;"">Principais Funções e Benefícios</span></span></span></strong></p><p><span style=""color:#000000;""><span style=""font-size:16px;""><span style=""font-family:verdana,geneva,sans-serif;"">Restaura a Aparência: Ajuda a recuperar a cor e o brilho de paredes e Cristais, fazendo com que pareçam novos novamente.</span></span></span></p><p><span style=""color:#000000;""><span style=""font-size:16px;""><span style=""font-family:verdana,geneva,sans-serif;"">Proteção Duradoura: Contém aditivos e alta dosagem de Resina que oferecem proteção contra umidade, mofo e fungos, prolongando a vida útil da superfície.</span></span></span></p><p><span style=""color:#000000;""><span style=""font-size:16px;""><span style=""font-family:verdana,geneva,sans-serif;"">Facilidade de Aplicação: Produto de fácil aplicação, podendo ser usado com pincel, rolo ou compressor, permitindo uma cobertura uniforme.</span></span></span></p><p><span style=""color:#000000;""><span style=""font-size:16px;""><span style=""font-family:verdana,geneva,sans-serif;"">Versatilidade: Pode ser utilizado em diferentes tipos de superfícies, como concreto, cimento, gesso e pintura, adaptando-se a diversas necessidades de revitalização.</span></span></span></p><p><span style=""color:#000000;""><span style=""font-size:16px;""><span style=""font-family:verdana,geneva,sans-serif;"">Cobertura de Imperfeições: Tem a capacidade de disfarçar pequenas imperfeições, manchas ou desgastes, proporcionando um acabamento mais liso e uniforme.</span></span></span></p><p><span style=""color:#000000;""><span style=""font-size:16px;""><span style=""font-family:verdana,geneva,sans-serif;"">Aumento do Valor Estético: Ao melhorar a aparência das paredes ou Cristais, contribui para a valorização do ambiente, seja em residências ou espaços comerciais.</span></span></span></p><p><span style=""color:#000000;""><span style=""font-size:16px;""><span style=""font-family:verdana,geneva,sans-serif;"">Durabilidade Prolongada: Oferece um acabamento duradouro, resistindo ao desgaste do tempo e mantendo a beleza das paredes por mais tempo, sendo recomendada manutenção anualmente.</span></span></span></p><p> </p><p><span style=""color:#000000;""><span style=""font-size:16px;""><span style=""font-family:verdana,geneva,sans-serif;"">Em resumo, o Revitalizador Forte Mais é uma solução prática e eficaz para quem deseja renovar e proteger as superfícies de suas paredes, Cristais e Repinturas, garantindo um ambiente mais agradável, bem cuidado e aumentando a vida útil do mesmo.</span></span></span></p></div>",https://images.tcdn.com.br/img/img_prod/1139809/revitalizador_de_cristais_fortemais_3_6lt_4418_1_5eafbfe6e5d95a5583777ccec370b56c.png,
4094,"Fundo Nivelador Base Água Fosco Cia Acqua Branco Ciacollor 0,9lt",33.78,http://www.mercotintas.com.br/linha-imobiliaria/fundo-nivelador-base-agua-fosco-cia-acqua-branco-ciacollor-0-9lt,https://images.tcdn.com.br/img/img_prod/1139809/fundo_nivelador_base_agua_fosco_cia_acqua_branco_ciacollor_0_9lt_4094_1_5bdd93c5c31faa54b045860a3dfa23ee.png,"<div class=""tab rte description-ab active"" id=""descricao""><p style=""box-sizing: border-box; margin-top: 0px; margin-bottom: 1rem; text-align: justify;""><span style=""font-size:16px;""><span style=""font-family:verdana,geneva,sans-serif;""><span style=""box-sizing: border-box; font-weight: bolder;"">PREPARAÇÃO DA SUPERFÍCIE / INSTRUÇÕES DE USO</span></span></span></p><p style=""box-sizing: border-box; margin-top: 0px; margin-bottom: 1rem; text-align: justify;""><span style=""font-size:14px;""><span style=""font-family:verdana,geneva,sans-serif;""><u style=""box-sizing: border-box;"">Madeira Nova:</u> eliminar as farpas, retirando a poeira com um pano úmido. Aplicar uma demão de Fundo Fosco Base Água. Em caso de imperfeições, corrigir com Massa para Madeira. Nivelar porosidade com mais uma demão de Fundo Nivelador Fosco Cia Acqua e em seguida aplicar o Esmalte Sintético, Tinta à Óleo ou Esmalte Base Água.</span></span></p><p style=""box-sizing: border-box; margin-top: 0px; margin-bottom: 1rem; text-align: justify;""><span style=""font-size:14px;""><span style=""font-family:verdana,geneva,sans-serif;"">OBS: em caso de repintura, certificar que não haja brilho na superfície e apenas depois aplicar o esmalte ou tinta à óleo. Se houver brilho, eliminar com lixa adequada. A não observância deste processo pode acarretar problemas de baixo brilho e aderência no acabamento.</span></span></p><p style=""box-sizing: border-box; margin-top: 0px; margin-bottom: 1rem; text-align: justify;""> </p><p style=""box-sizing: border-box; margin-top: 0px; margin-bottom: 1rem; text-align: justify;""><span style=""font-size:16px;""><span style=""font-family:verdana,geneva,sans-serif;""><span style=""box-sizing: border-box; font-weight: bolder;"">PREPARAÇÃO DO PRODUTO</span></span></span></p><p style=""box-sizing: border-box; margin-top: 0px; margin-bottom: 1rem; text-align: justify;""><span style=""font-size:14px;""><span style=""font-family:verdana,geneva,sans-serif;"">Assim que abrir a embalagem, mexa o produto com uma espátula/régua ou similar para que este se torne homogêneo.</span></span></p><p style=""box-sizing: border-box; margin-top: 0px; margin-bottom: 1rem; text-align: justify;""> </p><p style=""box-sizing: border-box; margin-top: 0px; margin-bottom: 1rem; text-align: justify;""><span style=""font-size:14px;""><span style=""font-family:verdana,geneva,sans-serif;""><span style=""font-size:16px;""><span style=""box-sizing: border-box; font-weight: bolder;"">DILUIÇÃO</span></span><br style=""box-sizing: border-box;""/>De 10 a 20% com água limpa</span></span></p><p style=""box-sizing: border-box; margin-top: 0px; margin-bottom: 1rem; text-align: justify;""><span style=""font-size:14px;""><span style=""font-family:verdana,geneva,sans-serif;"">Antes de iniciar a pintura, mexa o produto novamente para que atinja o ponto ideal para aplicação e rendimento.</span></span></p><p style=""box-sizing: border-box; margin-top: 0px; margin-bottom: 1rem; text-align: justify;""> </p><p style=""box-sizing: border-box; margin-top: 0px; margin-bottom: 1rem; text-align: justify;""><span style=""font-size:16px;""><span style=""font-family:verdana,geneva,sans-serif;""><span style=""box-sizing: border-box; font-weight: bolder;"">FERRAMENTAS</span></span></span></p><p style=""box-sizing: border-box; margin-top: 0px; margin-bottom: 1rem; text-align: justify;""><span style=""font-size:14px;""><span style=""font-family:verdana,geneva,sans-serif;"">Rolo, pincel ou pistola.</span></span></p><p style=""box-sizing: border-box; margin-top: 0px; margin-bottom: 1rem; text-align: justify;""> </p><p style=""box-sizing: border-box; margin-top: 0px; margin-bottom: 1rem; text-align: justify;""><span style=""font-size:16px;""><span style=""font-family:verdana,geneva,sans-serif;""><span style=""box-sizing: border-box; font-weight: bolder;"">CAMADAS</span></span></span></p><p style=""box-sizing: border-box; margin-top: 0px; margin-bottom: 1rem; text-align: justify;""><span style=""font-size:14px;""><span style=""font-family:verdana,geneva,sans-serif;"">Recomendamos a pintura em 2 camadas, respeitando o tempo de 4 horas entre camadas. Dependendo das condições da superfície pode haver necessidade de uma camada adicional.</span></span></p><p style=""box-sizing: border-box; margin-top: 0px; margin-bottom: 1rem; text-align: justify;""><span style=""font-size:14px;""><span style=""font-family:verdana,geneva,sans-serif;""><span style=""box-sizing: border-box; font-weight: bolder;""> </span></span></span></p><p style=""box-sizing: border-box; margin-top: 0px; margin-bottom: 1rem; text-align: justify;""><span style=""font-size:16px;""><span style=""font-family:verdana,geneva,sans-serif;""><span style=""box-sizing: border-box; font-weight: bolder;"">RENDIMENTO</span></span></span></p><p style=""box-sizing: border-box; margin-top: 0px; margin-bottom: 1rem; text-align: justify;""><span style=""font-size:14px;""><span style=""font-family:verdana,geneva,sans-serif;"">900 mL: 7,5 a 10 m<span style=""box-sizing: border-box; position: relative; line-height: 0; vertical-align: baseline; top: -0.5em;"">2</span> / demão</span></span></p><p style=""box-sizing: border-box; margin-top: 0px; margin-bottom: 1rem; text-align: justify;""><span style=""font-size:14px;""><span style=""font-family:verdana,geneva,sans-serif;"">3,6 L: 30 a 40 m<span style=""box-sizing: border-box; position: relative; line-height: 0; vertical-align: baseline; top: -0.5em;"">2</span> / demão</span></span></p><p style=""box-sizing: border-box; margin-top: 0px; margin-bottom: 1rem; text-align: justify;""><span style=""font-size:14px;""><span style=""font-family:verdana,geneva,sans-serif;"">O rendimento pode sofrer alteração de acordo com a superfície, ferramenta utilizada e experiência do aplicador.</span></span></p><p style=""box-sizing: border-box; margin-top: 0px; margin-bottom: 1rem; text-align: justify;""> </p><p style=""box-sizing: border-box; margin-top: 0px; margin-bottom: 1rem; text-align: justify;""><span style=""font-size:16px;""><span style=""font-family:verdana,geneva,sans-serif;""><span style=""box-sizing: border-box; font-weight: bolder;"">SECAGEM</span></span></span></p><p style=""box-sizing: border-box; margin-top: 0px; margin-bottom: 1rem; text-align: justify;""><span style=""font-size:14px;""><span style=""font-family:verdana,geneva,sans-serif;"">1 hora ao toque, 4 horas entre demãos e 24 horas final. Este tempo pode variar de acordo com as condições climáticas locais no momento da aplicação.</span></span></p><p style=""box-sizing: border-box; margin-top: 0px; margin-bottom: 1rem; text-align: justify;""> </p></div>",https://images.tcdn.com.br/img/img_prod/1139809/fundo_nivelador_base_agua_fosco_cia_acqua_branco_ciacollor_0_9lt_4094_1_5bdd93c5c31faa54b045860a3dfa23ee.png,
3645,"Esmalte Sintético Acetinado Ciacollor 0,9lt",39.15,http://www.mercotintas.com.br/linha-imobiliaria/esmalte-sintetico-acetinado-ciacollor-0-9lt,https://images.tcdn.com.br/img/img_prod/1139809/esmalte_sintetico_acetinado_ciacollor_0_9lt_3645_1_3f0f30f9438019b2c56c66caef0be092.png,"<div class=""tab rte description-ab active"" id=""descricao""><p><strong><span style=""font-size:14px;""><span style=""font-family:verdana,geneva,sans-serif;""><font color=""#212529"">Esmalte Sintético Madeiras/Metais Ciacollor </font></span></span></strong><span style=""font-family:verdana,geneva,sans-serif;""><span style=""color: rgb(33, 37, 41); font-size: 14px; text-align: center;"">É um esmalte alquídico à base de solventes orgânicos com acabamento fosco indicado para aplicação em superfícies metálicas, madeira ou alvenaria em áreas externas e internas. Proporciona excelente resistência ao intemperismo e radiação solar prolongando a durabilidade da pintura. Este produto segue classificação da norma NBR 11702 tipo 4.2.1.6 (fosco), tipo 4.2.14 (brilhante) e tipo 4.2.15 (acetinado).</span></span></p><p> </p><p> </p><p apple="""" cie="""" color="""" da="""" de="""" es="""" font-size:="""" helvetica="""" noto="""" o="""" p="""" segoe="""" span="""" style=""box-sizing: border-box; margin-top: 0px; margin-bottom: 1rem; color: rgb(33, 37, 41); font-family: Montserrat, -apple-system, BlinkMacSystemFont, "" ui=""""><span style=""font-size:14px;""><span style=""font-family:verdana,geneva,sans-serif;""><strong><u style=""box-sizing: border-box;"">Madeira Nova:</u></strong> eliminar as farpas, retirando a poeira com um pano úmido. Aplicar uma demão de Fundo Sintético Nivelador Ciacollor. Em caso de imperfeições, corrigir com Massa para Madeira. Nivelar porosidade com mais uma demão de Fundo Sintético Nivelador Ciacollor em seguida aplicar o Esmalte Sintético Ciacollor. Em caso de aplicação de vernizes, preparar a superfície com uma demão de Seladora para Madeira diluído com thinner forte. Lixar após 1 hora e eliminar a poeira. Finalizar aplicando o verniz.</span></span></p><p a="""" aplicar="""" apple="""" ciacollor.="""" cie="""" cies="""" color="""" com="""" de="""" do="""" eliminar="""" em="""" embebido="""" esmalte="""" ferro="""" ferrugem="""" font-size:="""" helvetica="""" impureza.="""" limpar="""" noto="""" o="""" ou="""" outra="""" p="""" pano="""" pontos="""" qualquer="""" s="""" secagem="""" seco="""" segoe="""" span="""" style=""box-sizing: border-box; margin-top: 0px; margin-bottom: 1rem; color: rgb(33, 37, 41); font-family: Montserrat, -apple-system, BlinkMacSystemFont, "" thinner="""" tico="""" u="""" ui="""" um="""" uma="""" veis="""" z.=""""><span style=""font-size:14px;""><span style=""font-family:verdana,geneva,sans-serif;""><strong><u style=""box-sizing: border-box;"">Superfícies galvanizadas ou de alumínio:</u> </strong>Limpar com um pano úmido e aguardar a secagem. Aplicar uma demão de fundo para galvanizado. Aguardar secagem do fundo e depois aplicar o esmalte.</span></span></p><p a="""" acarretar="""" adequada.="""" apenas="""" aplicar="""" apple="""" baixo="""" brilho="""" caso="""" certificar="""" cie="""" color="""" com="""" de="""" depois="""" deste="""" e="""" eliminar="""" em="""" esmalte.="""" font-size:="""" haja="""" helvetica="""" houver="""" lixa="""" na="""" ncia="""" noto="""" o="""" p="""" pode="""" problemas="""" processo="""" que="""" se="""" segoe="""" span="""" style=""box-sizing: border-box; margin-top: 0px; margin-bottom: 1rem; color: rgb(33, 37, 41); font-family: Montserrat, -apple-system, BlinkMacSystemFont, "" ui=""""> </p><p apple="""" color="""" do="""" font-size:="""" helvetica="""" noto="""" o="""" p="""" segoe="""" span="""" style=""box-sizing: border-box; margin-top: 0px; margin-bottom: 1rem; color: rgb(33, 37, 41); font-family: Montserrat, -apple-system, BlinkMacSystemFont, "" ui=""""><span style=""font-size:14px;""><span style=""font-family:verdana,geneva,sans-serif;"">Assim que abrir a embalagem, mexa o produto com uma espátula/régua ou similar para que este se torne homogêneo.</span></span></p><p apple="""" color="""" font-size:="""" helvetica="""" noto="""" p="""" segoe="""" style=""box-sizing: border-box; margin-top: 0px; margin-bottom: 1rem; color: rgb(33, 37, 41); font-family: Montserrat, -apple-system, BlinkMacSystemFont, "" ui=""""><span style=""font-size:14px;""><span style=""font-family:verdana,geneva,sans-serif;""><span style=""font-size:16px;""><strong><span style=""box-sizing: border-box; font-weight: bolder;"">DILUIÇÃO</span></strong></span><br style=""box-sizing: border-box;""/>De 10 a 20% com aguarráz.</span></span></p><p a="""" antes="""" apple="""" atinja="""" color="""" de="""" e="""" font-size:="""" helvetica="""" ideal="""" iniciar="""" mexa="""" noto="""" novamente="""" o="""" p="""" para="""" ponto="""" produto="""" que="""" segoe="""" span="""" style=""box-sizing: border-box; margin-top: 0px; margin-bottom: 1rem; color: rgb(33, 37, 41); font-family: Montserrat, -apple-system, BlinkMacSystemFont, "" ui=""""> </p><p apple="""" color="""" font-size:="""" helvetica="""" noto="""" p="""" segoe="""" span="""" style=""box-sizing: border-box; margin-top: 0px; margin-bottom: 1rem; color: rgb(33, 37, 41); font-family: Montserrat, -apple-system, BlinkMacSystemFont, "" ui=""""><span style=""font-size:14px;""><span style=""font-family:verdana,geneva,sans-serif;"">Rolo, pincel, ou pistola.</span></span></p><p apple="""" color="""" font-size:="""" helvetica="""" noto="""" p="""" segoe="""" style=""box-sizing: border-box; margin-top: 0px; margin-bottom: 1rem; color: rgb(33, 37, 41); font-family: Montserrat, -apple-system, BlinkMacSystemFont, "" ui=""""><span style=""font-size:16px;""><span style=""font-family:verdana,geneva,sans-serif;""><span style=""box-sizing: border-box; font-weight: bolder;"">CAMADAS</span></span></span></p><p 2="""" 4="""" a="""" apple="""" camada="""" camadas.="""" cie="""" color="""" da="""" das="""" de="""" dependendo="""" em="""" entre="""" es="""" font-size:="""" haver="""" helvetica="""" horas="""" necessidade="""" noto="""" o="""" p="""" pintura="""" pode="""" recomendamos="""" respeitando="""" segoe="""" span="""" style=""box-sizing: border-box; margin-top: 0px; margin-bottom: 1rem; color: rgb(33, 37, 41); font-family: Montserrat, -apple-system, BlinkMacSystemFont, "" tempo="""" ui="""" uma=""""><span style=""font-size:14px;""><span style=""font-family:verdana,geneva,sans-serif;""><span style=""box-sizing: border-box; font-weight: bolder;""> </span></span></span></p><p apple="""" color="""" font-size:="""" helvetica="""" noto="""" p="""" segoe="""" span="""" style=""box-sizing: border-box; margin-top: 0px; margin-bottom: 1rem; color: rgb(33, 37, 41); font-family: Montserrat, -apple-system, BlinkMacSystemFont, "" ui=""""><span style=""font-size:14px;""><span style=""font-family:verdana,geneva,sans-serif;"">810 mL: 9 a 10 m<span style=""box-sizing: border-box; position: relative; line-height: 0; vertical-align: baseline; top: -0.5em;"">2</span> / demão</span></span></p><p 24="""" 36="""" 43="""" a="""" apple="""" color="""" font-size:="""" helvetica="""" l:="""" noto="""" p="""" segoe="""" span="""" style=""box-sizing: border-box; margin-top: 0px; margin-bottom: 1rem; color: rgb(33, 37, 41); font-family: Montserrat, -apple-system, BlinkMacSystemFont, "" ui=""""><span style=""font-size:14px;""><span style=""font-family:verdana,geneva,sans-serif;"">O rendimento pode sofrer alteração de acordo com a superfície, ferramenta utilizada e experiência do aplicador.</span></span></p><p apple="""" color="""" font-size:="""" helvetica="""" noto="""" p="""" segoe="""" span="""" style=""box-sizing: border-box; margin-top: 0px; margin-bottom: 1rem; color: rgb(33, 37, 41); font-family: Montserrat, -apple-system, BlinkMacSystemFont, "" ui=""""><span style=""font-size:16px;""><span style=""font-family:verdana,geneva,sans-serif;""><span style=""box-sizing: border-box; font-weight: bolder;"">SECAGEM</span></span></span></p><p> </p><p> </p><p> </p><p><p ""apple="""" ""helvetica="""" ""noto="""" ""segoe="""" 14px;""="""" arial,="""" color="""" emoji"",="""" emoji"";="""" font-size:="""" neue"",="""" roboto,="""" sans"",="""" sans-serif,="""" segoe="""" style=""box-sizing: border-box; margin-top: 0px; margin-bottom: 1rem; color: rgb(33, 37, 41); font-family: Montserrat, -apple-system, BlinkMacSystemFont, "" symbol"",="""" ui="""" ui"",=""""><span style=""font-size:14px;""><span style=""font-family:verdana,geneva,sans-serif;"">2 a 4 horas ao toque, 6 horas entre demãos e 72 horas final. Este tempo pode variar de acordo com as condições climáticas locais no momento da aplicação.</span></span></p></p></div>",https://images.tcdn.com.br/img/img_prod/1139809/esmalte_sintetico_acetinado_ciacollor_0_9lt_3645_1_3f0f30f9438019b2c56c66caef0be092.png,Cor: Branco Neve [R$39.15] (Stock:SI)
2489,"Selador Emborrachado Ciaflex Ciacollor 3,6kg",64.36,http://www.mercotintas.com.br/linha-imobiliaria/selador-emborrachado-ciaflex-ciacollor-3-6kg,https://images.tcdn.com.br/img/img_prod/1139809/selador_emborrachado_ciaflex_ciacollor_3_6kg_2489_1_c10f58e6a0b7fde63debd31e72500667.png,"<div class=""tab rte description-ab active"" id=""descricao""><p><span style=""font-size: 14px;""><span style=""font-family: verdana, geneva, sans-serif;""><strong>O Selador Emborrachado Ciaflex </strong>É um selador emborrachado acrílico indicado para aplicação em paredes de alvenaria que confere bom poder de enchimento e aderência ao substrato.</span></span></p><p> </p><p><span style=""font-size: 16px;""><strong><span style=""font-family: verdana, geneva, sans-serif;"">PREPARAÇÃO DA SUPERFÍCIE / INSTRUÇÕES DE USO</span></strong></span></p><p><span style=""font-size: 14px;""><span style=""font-family: verdana, geneva, sans-serif;""><strong>Geral:</strong> Toda superfície deve estar devidamente limpa, porosa e seca, isenta de pó ou qualquer outro tipo de sujeira. Em caso de superfícies engorduradas ou com graxa, remover primeiramente a sujeira com água e detergente. Em superfícies mofadas, aplicar solução de água e hipoclorito de sódio na proporção de uma parte de água para uma parte de hipoclorito de sódio e enxaguar após 6 horas. Aplicar o impermeabilizante após no mínimo 24 horas de secagem. Superfícies que possuem brilho devem ser lixadas e limpas antes da aplicação do acabamento.</span></span></p><p><span style=""font-size: 14px;""><span style=""font-family: verdana, geneva, sans-serif;""><strong>Reboco Novo: </strong>Após 28 dias de cura do reboco, aplicar de 1 a 2 demãos do Selador Ciaflex, respeitando o intervalo de secagem e diluição indicados na embalagem.</span></span></p><p><span style=""font-size: 14px;""><span style=""font-family: verdana, geneva, sans-serif;""><strong>Reboco fraco ou caiação:</strong> proceder a remoção das partes soltas, lixar e aplicar o fundo preparador de paredes Ciacollor. Em alguns casos se faz necessário o uso de massa acrílica (exterior) ou massa corrida (interior) para correção da superfície antes da aplicação do impermeabilizante.</span></span></p><p><span style=""font-size: 14px;""><span style=""font-family: verdana, geneva, sans-serif;""><strong>Microfissuras:</strong> para prevenção e correção, aplicar de 4 a 6 demãos cruzadas de Selador Ciaflex e aguardar pelo menos 24 horas para aplicação de Tinta Acrílica.</span></span></p><p><span style=""font-size: 14px;""><span style=""font-family: verdana, geneva, sans-serif;""><strong>OBS:</strong> Se for aplicar o Selador Ciaflex como fundo para aplicação posterior de Textura Ciacollor ou Collorgraf, aplicar apenas uma demão do produto. A não observância deste procedimento pode causar problemas futuros.</span></span></p><p> </p><p><span style=""font-size: 16px;""><span style=""font-family: verdana, geneva, sans-serif;""><strong>DILUIÇÃO</strong></span></span></p><p><span style=""font-size: 14px;""><span style=""font-family: verdana, geneva, sans-serif;"">Todas as camadas: diluir de 10 a 20% com água limpa Antes de iniciar a pintura, mexa o produto novamente para que atinja o ponto ideal para aplicação e rendimento.</span></span></p><p> </p><p><span style=""font-size: 16px;""><strong><span style=""font-family: verdana, geneva, sans-serif;"">FERRAMENTAS</span></strong></span></p><p><span style=""font-size: 14px;""><span style=""font-family: verdana, geneva, sans-serif;"">Rolo, trincha e pistola.</span></span></p><p> </p><p><span style=""font-size: 14px;""><span style=""font-family: verdana, geneva, sans-serif;""><span style=""font-size: 16px;""><strong>CAMADAS</strong></span></span></span></p><p><span style=""font-size: 14px;""><span style=""font-family: verdana, geneva, sans-serif;"">Paredes de alvenaria: aplicar de 1 a 2 demãos para cobertura do produto. Se utilizado para prevenção e correção de microfissuras deve-se aplicar de 4 a 6 demãos.</span></span></p><p> </p><p><span style=""font-size: 16px;""><strong><span style=""font-family: verdana, geneva, sans-serif;"">RENDIMENTO</span></strong></span></p><p><span style=""font-size: 14px;""><span style=""font-family: verdana, geneva, sans-serif;"">3,6 Kg: 20 a 40 m² / demão 18 Kg: 100 a 200 m2 / demão</span></span></p><p><span style=""font-size: 14px;""><span style=""font-family: verdana, geneva, sans-serif;"">*O rendimento pode sofrer alteração de acordo com a superfície, ferramenta utilizada e experiência do aplicador.</span></span></p><p> </p><p><span style=""font-size: 16px;""><strong><span style=""font-family: verdana, geneva, sans-serif;"">SECAGEM</span></strong></span></p><p><span style=""font-size: 14px;""><span style=""font-family: verdana, geneva, sans-serif;"">1 hora ao toque, 4 horas entre demãos e 24 horas final. Este tempo pode variar de acordo com as condições climáticas locais no momento da aplicação. </span></span></p></div>",https://images.tcdn.com.br/img/img_prod/1139809/selador_emborrachado_ciaflex_ciacollor_3_6kg_2489_1_c10f58e6a0b7fde63debd31e72500667.png,
