ID,Nombre,Precio,Link,Imagen_Base,Descripcion,Galeria_Fotos,Info_Variantes
3637,"Fundo Sintético Nivelador Ciacollor 3,6lt",129.52,http://www.mercotintas.com.br/linha-imobiliaria/fundo-sintetico-nivelador-ciacollor-3-6lt,https://images.tcdn.com.br/img/img_prod/1139809/fundo_sintetico_nivelador_ciacollor_3_6lt_3637_1_890dd18df9a8bb4990d75059b728af39.png,"<div class=""tab rte description-ab active"" id=""descricao""><div><span style=""font-size: 16px;""><strong><span style=""font-family: verdana, geneva, sans-serif;"">PREPARAÇÃO DA SUPERFÍCIE / INSTRUÇÕES DE USO</span></strong></span></div><div> </div><div><span style=""font-size: 14px;""><span style=""font-family: verdana, geneva, sans-serif;"">Madeira Nova: eliminar as farpas, retirando a poeira com um pano úmido. Aplicar uma demão de Fundo Sintético Nivelador Ciacollor. Em caso de imperfeições, corrigir com Massa para Madeira. Nivelar porosidade com mais uma demão de Fundo Sintético Nivelador e em seguida aplicar o Esmalte Sintético Ciacollor ou a Tinta Óleo Ciacollor.</span></span></div><div> </div><div><span style=""font-size: 14px;""><span style=""font-family: verdana, geneva, sans-serif;"">OBS: em caso de repintura, certificar que não haja brilho na superfície e apenas depois aplicar o esmalte ou tinta à óleo. Se houver brilho, eliminar com lixa adequada. A não observância deste processo pode acarretar problemas de baixo brilho e aderência no acabamento.</span></span></div><div> </div><div> </div><div> </div><div><span style=""font-size: 16px;""><strong><span style=""font-family: verdana, geneva, sans-serif;"">PREPARAÇÃO DO PRODUTO</span></strong></span></div><div> </div><div><span style=""font-size: 14px;""><span style=""font-family: verdana, geneva, sans-serif;"">Assim que abrir a embalagem, mexa o produto com uma espátula/régua ou similar para que este se torne homogêneo.</span></span></div><div> </div><div> </div><div> </div><div><strong><span style=""font-size: 16px;""><span style=""font-family: verdana, geneva, sans-serif;"">DILUIÇÃO</span></span></strong></div><div> </div><div><span style=""font-size: 14px;""><span style=""font-family: verdana, geneva, sans-serif;"">De 10 a 20% com aguarráz.</span></span></div><div> </div><div><span style=""font-size: 14px;""><span style=""font-family: verdana, geneva, sans-serif;"">Antes de iniciar a pintura, mexa o produto novamente para que atinja o ponto ideal para aplicação e rendimento.</span></span></div><div> </div><div> </div><div> </div><div><span style=""font-size: 16px;""><strong><span style=""font-family: verdana, geneva, sans-serif;"">FERRAMENTAS</span></strong></span></div><div> </div><div><span style=""font-size: 14px;""><span style=""font-family: verdana, geneva, sans-serif;"">Rolo, pincel, ou pistola.</span></span></div><div> </div><div> </div><div> </div><div><strong><span style=""font-size: 16px;""><span style=""font-family: verdana, geneva, sans-serif;"">CAMADAS</span></span></strong></div><div> </div><div><span style=""font-size: 14px;""><span style=""font-family: verdana, geneva, sans-serif;"">Recomendamos a pintura em 2 camadas, respeitando o tempo de 4 horas entre camadas. Dependendo das condições da superfície pode haver necessidade de uma camada adicional.</span></span></div><div> </div><div><span style=""font-size: 14px;""><span style=""font-family: verdana, geneva, sans-serif;""> </span></span></div><div> </div><div><strong><span style=""font-size: 16px;""><span style=""font-family: verdana, geneva, sans-serif;"">RENDIMENTO</span></span></strong></div><div> </div><div><span style=""font-size: 14px;""><span style=""font-family: verdana, geneva, sans-serif;"">900 mL: 7 a 9 m2 / demão</span></span></div><div> </div><div><span style=""font-size: 14px;""><span style=""font-family: verdana, geneva, sans-serif;"">3,6 L: 28 a 36 m2 / demão</span></span></div><div> </div><div><span style=""font-size: 14px;""><span style=""font-family: verdana, geneva, sans-serif;"">18 L: 140 a 180 m2 / demão</span></span></div><div> </div><div><span style=""font-size: 14px;""><span style=""font-family: verdana, geneva, sans-serif;"">O rendimento pode sofrer alteração de acordo com a superfície, ferramenta utilizada e experiência do aplicador.</span></span></div><div> </div><div> </div><div> </div><div><strong><span style=""font-size: 16px;""><span style=""font-family: verdana, geneva, sans-serif;"">SECAGEM</span></span></strong></div><div> </div><div><span style=""font-size: 14px;""><span style=""font-family: verdana, geneva, sans-serif;"">4 a 6 horas ao toque, 8 horas entre demãos e 72 horas final. Este tempo pode variar de acordo com as condições climáticas locais no momento da aplicação.</span></span></div></div>",https://images.tcdn.com.br/img/img_prod/1139809/fundo_sintetico_nivelador_ciacollor_3_6lt_3637_1_890dd18df9a8bb4990d75059b728af39.png,
2487,Massa Acrílica Emborrachada Ciaflex Ciacollor 6kg,66.71,http://www.mercotintas.com.br/linha-imobiliaria/massa-acrilica-emborrachada-ciaflex-ciacollor-6kg,https://images.tcdn.com.br/img/img_prod/1139809/massa_acrilica_emborrachada_ciaflex_ciacollor_6kg_2487_1_c10f58e6a0b7fde63debd31e72500667.png,"<div class=""tab rte description-ab active"" id=""descricao""><p><span style=""font-size: 14px;""><span style=""font-family: verdana, geneva, sans-serif;"">A <strong>Massa Acrílica Emborrachada Ciaflex</strong> possui polímeros elastoméricos é indicada para nivelar e corrigir imperfeições em paredes e tetos de alvenaria, gesso, reboco, fibrocimento, concreto e cimentado em áreas internas e externas sujeitas ao aparecimento de microfissuras. Segue classificação da norma NBR 11702 tipo 4.7.1 e NBR 15348.</span></span></p><p> </p><p><strong><span style=""font-size: 16px;""><span style=""font-family: verdana, geneva, sans-serif;"">PREPARAÇÃO</span></span></strong></p><p><span style=""font-size: 14px;""><span style=""font-family: verdana, geneva, sans-serif;"">Este produto não exige homogeneização.</span></span></p><p> </p><p><span style=""font-size: 16px;""><strong><span style=""font-family: verdana, geneva, sans-serif;"">DILUIÇÃO</span></strong></span></p><p><span style=""font-size: 14px;""><span style=""font-family: verdana, geneva, sans-serif;"">Pronto para uso.</span></span></p><p> </p><p><strong><span style=""font-size: 16px;""><span style=""font-family: verdana, geneva, sans-serif;"">FERRAMENTAS</span></span></strong></p><p><span style=""font-size: 14px;""><span style=""font-family: verdana, geneva, sans-serif;"">Espátula ou desempenadeira de aço.</span></span></p><p> </p><p><span style=""font-size: 16px;""><strong><span style=""font-family: verdana, geneva, sans-serif;"">CAMADAS</span></strong></span></p><p><span style=""font-size: 14px;""><span style=""font-family: verdana, geneva, sans-serif;"">Recomendamos a aplicação em 2 camadas, respeitando o tempo de 4 horas entre camadas. Dependendo das condições da superfície pode haver necessidade de uma camada adicional.</span></span></p><p> </p><p><span style=""font-size: 16px;""><strong><span style=""font-family: verdana, geneva, sans-serif;"">RENDIMENTO</span></strong></span></p><p><span style=""font-size: 14px;""><span style=""font-family: verdana, geneva, sans-serif;"">Embalagem 900 mL: até 2,2 m² por demão (massa grossa) / até 4,6 m² por demão (massa fina)</span></span></p><p><span style=""font-size: 14px;""><span style=""font-family: verdana, geneva, sans-serif;"">Galão 3,6 Litros: até 8,4 m² por demão (massa grossa) / até 17,6 m² por demão (massa grossa)</span></span></p><p><span style=""font-size: 14px;""><span style=""font-family: verdana, geneva, sans-serif;"">Lata 18 Litros: até 40 m² por demão (massa grossa) / até 84 m² por demão (massa grossa)</span></span></p><p><span style=""font-size: 14px;""><span style=""font-family: verdana, geneva, sans-serif;"">Saco 15 Kg: até 21 m² por demão (massa grossa) / até 44 m² por demão (massa grossa) </span></span></p><p><span style=""font-size: 14px;""><span style=""font-family: verdana, geneva, sans-serif;"">Barrica ou lata 25 Kg: até 35 m² por demão (massa grossa) / até 75 m² por demão (massa fina)</span></span></p><p><span style=""font-size: 14px;""><span style=""font-family: verdana, geneva, sans-serif;"">*O rendimento pode sofrer alteração de acordo com a superfície, ferramentas utilizadas no espalhamento do produto, experiência do aplicador e também ao método de aplicação utilizado (aplicação fina ou grossa). </span></span></p><p> </p><p><span style=""font-size: 16px;""><span style=""font-family: verdana, geneva, sans-serif;""><strong>SECAGEM</strong></span></span></p><p><span style=""font-family: verdana, geneva, sans-serif;""><span style=""font-size: 14px;"">30 minutos ao toque, 4 horas entre demãos e 6 horas final. Este tempo pode variar de acordo com as condições climáticas locais no momento da aplicação.</span></span>  </p></div>",https://images.tcdn.com.br/img/img_prod/1139809/massa_acrilica_emborrachada_ciaflex_ciacollor_6kg_2487_1_c10f58e6a0b7fde63debd31e72500667.png,
2225,Spray Uso Geral Metálico Ciacollor 400ml,23.28,http://www.mercotintas.com.br/linha-spray/spray-uso-geral-metalico-ciacollor-400ml,https://images.tcdn.com.br/img/img_prod/1139809/spray_uso_geral_metalico_ciacollor_400ml_2225_1_157b689817047b2e7e4d82f583a832ca.png,"<div class=""tab rte description-ab active"" id=""descricao""><div class=""my-3 my-md-4 textos"" style=""box-sizing: border-box; margin-top: 1.5rem !important; margin-bottom: 1.5rem !important;""><p style=""box-sizing: border-box; margin-top: 0px; margin-bottom: 1rem;"">O Collor Spray Metálica é um produto de alto rendimento, alta aderência e excelente cobertura que possibilita realizar pinturas em superfícies de madeira, metais como: aço, ferro e alumínio em peças de artesanato, objetos de decoração, bicicletas, cercas, grades, móveis, eletrodomésticos, peças automotivas como para choques e rodas, entre outros. Pode ser aplicado em áreas internas e externas. Sua válvula 360º possibilita ao profissional mudar a direção do jato de acordo com a superfície a ser pintada facilitando a aplicação tanto na posição horizontal quanto na vertical.</p></div><div class=""row row-cols-3 justify-content-between"" style=""box-sizing: border-box; display: flex; flex-wrap: wrap; margin-right: -12.5px; margin-left: -12.5px; -webkit-box-pack: justify !important; justify-content: space-between !important;""><div !important;="""" !important;""="""" ""apple="""" ""helvetica="""" ""noto="""" ""segoe="""" 14px;="""" 1rem="""" arial,="""" center="""" class=""col beneficio text-center my-3"" color="""" emoji"",="""" emoji"";="""" font-size:="""" margin-bottom:="""" margin-top:="""" neue"",="""" roboto,="""" sans"",="""" sans-serif,="""" segoe="""" style=""box-sizing: border-box; position: relative; width: 196.656px; padding-right: 12.5px; padding-left: 12.5px; flex: 0 0 33.3333%; -webkit-box-flex: 0; max-width: 33.3333%; color: rgb(33, 37, 41); font-family: Montserrat, -apple-system, BlinkMacSystemFont, "" symbol"",="""" text-align:="""" ui="""" ui"",=""""> </div></div><a class=""tab-link-mobile"" href=""#AbaPersonalizadaConteudo8""><span class=""text"">                    Tenho garantia do produto?                </span></a><div class=""tab rte custom-tab"" id=""AbaPersonalizadaConteudo8"" style=""display: ""><div class=""board aba_personalizada""><br/><p><span style=""color:#102ea8;""><font face=""Verdana, Geneva, sans-serif""><span style=""font-size: 16px;"">Sim! Todos os produtos comprados possuem <strong>garantia dada pelo fabricante</strong>. Sempre que um pedido é feito uma nota fiscal é emitida e enviada por e-mail para que possa ser usada posteriormente para garantia, caso houver necessidade. </span></font></span></p></div></div></div>",https://images.tcdn.com.br/img/img_prod/1139809/spray_uso_geral_metalico_ciacollor_400ml_2225_2_0a01388c06f5080d50c8cdd9ee8161c5.jpg | https://images.tcdn.com.br/img/img_prod/1139809/90_spray_uso_geral_metalico_ciacollor_400ml_2225_2_0a01388c06f5080d50c8cdd9ee8161c5.jpg | https://images.tcdn.com.br/img/img_prod/1139809/90_spray_uso_geral_metalico_ciacollor_400ml_2225_1_157b689817047b2e7e4d82f583a832ca.png | https://images.tcdn.com.br/img/img_prod/1139809/spray_uso_geral_metalico_ciacollor_400ml_2225_1_157b689817047b2e7e4d82f583a832ca.png,Cor: Rose Gold [R$26.36] (Stock:NO) | Cor: Ouro [R$23.28] (Stock:NO) | Cor: Cobre [R$23.28] (Stock:SI)
2175,Resina Multiuso Base Solvente Ciacollor 18lt,679.14,http://www.mercotintas.com.br/linha-imobiliaria/resina-multiuso-base-solvente-ciacollor-18lt,https://images.tcdn.com.br/img/img_prod/1139809/resina_multiuso_base_solvente_ciacollor_18lt_2175_1_b6d4cc79df77d4508fb995b5e2248a46.png,"<div class=""tab rte description-ab active"" id=""descricao""><p><span style=""font-size:16px;""><span style=""font-family:Verdana,Geneva,sans-serif;""><span segoe="""" style=""color: rgb(33, 37, 41); font-family: Montserrat, -apple-system, BlinkMacSystemFont, "" ui=""""><strong>Resina Multiuso Base Solvente Incolor Ciacollor: Acabamento Brilhante e Proteção</strong><br/>A Resina Multiuso Base Solvente Incolor Ciacollor é uma resina acrílica de acabamento brilhante , classificada conforme a norma NBR 11702 tipo 4.8.3. É um produto ideal para selar e proteger diversas superfícies, realçando sua beleza natural.</span></span></span></p><p><span style=""font-size:16px;""><span style=""font-family:Verdana,Geneva,sans-serif;""><span segoe="""" style=""color: rgb(33, 37, 41); font-family: Montserrat, -apple-system, BlinkMacSystemFont, "" ui=""""><strong>Indicações de Uso</strong><br/>A resina é indicada para aplicação em:<br/>- Pisos cimentados.<br/>- Telhas cerâmicas, de concreto e de amianto.<br/>- Pedras naturais.<br/>- Tijolos à vista e concreto aparente.</span></span></span></p><p><span style=""font-size:16px;""><span style=""font-family:Verdana,Geneva,sans-serif;""><span segoe="""" style=""color: rgb(33, 37, 41); font-family: Montserrat, -apple-system, BlinkMacSystemFont, "" ui=""""><strong>Preparação da Superfície</strong><br/>A superfície deve estar limpa, porosa e seca, livre de pó ou sujeira.<br/>Superfícies com brilho: Devem ser lixadas e limpas antes da aplicação.<br/>Pisos de cimento queimado (baixa porosidade): É necessário tratar a superfície com ácido muriático (diluído em água na proporção de 1:2) para abrir a porosidade, enxaguar bem e aplicar a resina após 24 horas de secagem.</span></span></span><br/><span style=""font-size:16px;""><span style=""font-family:Verdana,Geneva,sans-serif;""><span segoe="""" style=""color: rgb(33, 37, 41); font-family: Montserrat, -apple-system, BlinkMacSystemFont, "" ui=""""><em>Atenção: Não utilizar o produto em superfícies esmaltadas, vitrificadas, com cera ou silicone. Não é recomendado para aplicação em pedras basálticas, pois pode haver esbranquiçamento.</em></span></span></span></p><p><span style=""font-size:16px;""><span style=""font-family:Verdana,Geneva,sans-serif;""><span segoe="""" style=""color: rgb(33, 37, 41); font-family: Montserrat, -apple-system, BlinkMacSystemFont, "" ui=""""><strong>Aplicação e Camadas</strong><br/>Diluição: O produto está pronto para uso, sem necessidade de diluição.<br/>Ferramentas: Rolo, pincel ou pistola.<br/>Camadas: Recomenda-se a pintura em 2 ou 3 camadas, respeitando o tempo de 6 horas entre elas.</span></span></span></p><p><span style=""font-size:16px;""><span style=""font-family:Verdana,Geneva,sans-serif;""><span segoe="""" style=""color: rgb(33, 37, 41); font-family: Montserrat, -apple-system, BlinkMacSystemFont, "" ui=""""><strong>Secagem</strong><br/>O tempo de secagem pode variar conforme as condições climáticas:<br/>Ao toque: 30 minutos.<br/>Entre demãos: 6 horas.<br/>Secagem final: 12 horas</span></span></span></p><p><span style=""font-size:16px;""><span style=""font-family:Verdana,Geneva,sans-serif;""><span segoe="""" style=""color: rgb(33, 37, 41); font-family: Montserrat, -apple-system, BlinkMacSystemFont, "" ui=""""><b>Rendimento por demão (m²)</b><br/>Pisos cimentados - 10m² a 11m² (0,9lt) | 40m² a 45m² (3,6lt) | 200m² a 225m² (18lt)<br/>Tijolos à vista - 8m² a 10m² (0,9lt) | 32m² a 40m² (3,6lt) | 160m² a 200m² (18lt)<br/>Unidade de telhas cerâmicas (montadas) - 117m² a 127m² (0,9lt) | 468m² a 508m² (3,6lt) | 2340m² a 2540m² (18lt)<br/>Telha de amianto (montadas) - 5,5m² a 6,5m² (0,9lt) | 22m² a 26m² (3,6lt) | 110m² a 130m² (18lt)<br/>Telha de cimento (montadas) - 7,5m² a 8,5m² (0,9lt) | 30m² a 34m² (3,6lt) | 150m² a 170m² (18lt)<br/>Pedras naturais - 7,5m² a 8,5m² (0,9lt) | 30m² a 34m² (3,6lt) | 150m² a 170m² (18lt)<br/>Concreto aparente - 9,5m² a 10m² (0,9lt) | 38m² a 40m² (3,6lt) | 185m² a 205m² (18lt)</span></span></span></p></div>",https://images.tcdn.com.br/img/img_prod/1139809/resina_multiuso_base_solvente_ciacollor_18lt_2175_1_b6d4cc79df77d4508fb995b5e2248a46.png | https://images.tcdn.com.br/img/img_prod/1139809/90_resina_multiuso_base_solvente_ciacollor_18lt_2175_1_b6d4cc79df77d4508fb995b5e2248a46.png | https://images.tcdn.com.br/img/img_prod/1139809/resina_multiuso_base_solvente_ciacollor_18lt_2175_2_7f4ce1f7bd1e41a49a10dd90910a220a.jpeg | https://images.tcdn.com.br/img/img_prod/1139809/90_resina_multiuso_base_solvente_ciacollor_18lt_2175_2_7f4ce1f7bd1e41a49a10dd90910a220a.jpeg,Cor: Cinza [R$962.22] (Stock:SI) | Cor: Incolor [R$679.14] (Stock:SI)
2169,"Massa Corrida Ciacollor 0,9lt",15.61,http://www.mercotintas.com.br/linha-imobiliaria/massa-corridaacrilica/massa-corrida-pva-premium-interior,https://images.tcdn.com.br/img/img_prod/1139809/massa_corrida_pva_premium_interior_0_9lt_2169_1_14abe6f31d215ad60bf11b4ad0248928.png,"<div class=""tab rte description-ab active"" id=""descricao""><p><span ""apple="""" ""helvetica="""" ""noto="""" ""segoe="""" 14px;""="""" arial,="""" color="""" emoji"",="""" emoji"";="""" font-size:="""" neue"",="""" roboto,="""" sans"",="""" sans-serif,="""" segoe="""" style=""color: rgb(33, 37, 41); font-family: Montserrat, -apple-system, BlinkMacSystemFont, "" symbol"",="""" ui="""" ui"",="""">Este produto é indicado para nivelar e corrigir imperfeições em paredes e tetos de alvenaria, gesso, reboco, fibrocimento, concreto e cimentado em áreas internas. Segue classificação da norma NBR 11702 tipo 4.7.2 e NBR 15348.</span></p></div>",https://images.tcdn.com.br/img/img_prod/1139809/massa_corrida_pva_premium_interior_0_9lt_2169_1_14abe6f31d215ad60bf11b4ad0248928.png,
