ID,Nombre,Precio,Link,Imagen_Base,Descripcion,Galeria_Fotos,Info_Variantes
4092,"Fundo Nivelador Base Água Fosco Cia Acqua Branco Ciacollor 3,6lt",108.72,http://www.mercotintas.com.br/linha-imobiliaria/fundo-nivelador-base-agua-fosco-cia-acqua-branco-ciacollor-3-6lt,https://images.tcdn.com.br/img/img_prod/1139809/fundo_nivelador_base_agua_fosco_cia_acqua_branco_ciacollor_3_6lt_4092_1_7d8e997189582a223640006f051820b6.png,"<div class=""tab rte description-ab active"" id=""descricao""><p style=""box-sizing: border-box; margin-top: 0px; margin-bottom: 1rem; text-align: justify;""><span style=""font-size: 16px;""><span style=""font-family: verdana, geneva, sans-serif;""><span style=""box-sizing: border-box; font-weight: bolder;"">PREPARAÇÃO DA SUPERFÍCIE / INSTRUÇÕES DE USO</span></span></span></p><p style=""box-sizing: border-box; margin-top: 0px; margin-bottom: 1rem; text-align: justify;""><span style=""font-size: 14px;""><span style=""font-family: verdana, geneva, sans-serif;""><u style=""box-sizing: border-box;"">Madeira Nova:</u> eliminar as farpas, retirando a poeira com um pano úmido. Aplicar uma demão de Fundo Fosco Base Água. Em caso de imperfeições, corrigir com Massa para Madeira. Nivelar porosidade com mais uma demão de Fundo Nivelador Fosco Cia Acqua e em seguida aplicar o Esmalte Sintético, Tinta à Óleo ou Esmalte Base Água.</span></span></p><p style=""box-sizing: border-box; margin-top: 0px; margin-bottom: 1rem; text-align: justify;""><span style=""font-size: 14px;""><span style=""font-family: verdana, geneva, sans-serif;"">OBS: em caso de repintura, certificar que não haja brilho na superfície e apenas depois aplicar o esmalte ou tinta à óleo. Se houver brilho, eliminar com lixa adequada. A não observância deste processo pode acarretar problemas de baixo brilho e aderência no acabamento.</span></span></p><p style=""box-sizing: border-box; margin-top: 0px; margin-bottom: 1rem; text-align: justify;""> </p><p style=""box-sizing: border-box; margin-top: 0px; margin-bottom: 1rem; text-align: justify;""><span style=""font-size: 16px;""><span style=""font-family: verdana, geneva, sans-serif;""><span style=""box-sizing: border-box; font-weight: bolder;"">PREPARAÇÃO DO PRODUTO</span></span></span></p><p style=""box-sizing: border-box; margin-top: 0px; margin-bottom: 1rem; text-align: justify;""><span style=""font-size: 14px;""><span style=""font-family: verdana, geneva, sans-serif;"">Assim que abrir a embalagem, mexa o produto com uma espátula/régua ou similar para que este se torne homogêneo.</span></span></p><p style=""box-sizing: border-box; margin-top: 0px; margin-bottom: 1rem; text-align: justify;""> </p><p style=""box-sizing: border-box; margin-top: 0px; margin-bottom: 1rem; text-align: justify;""><span style=""font-size: 14px;""><span style=""font-family: verdana, geneva, sans-serif;""><span style=""font-size: 16px;""><span style=""box-sizing: border-box; font-weight: bolder;"">DILUIÇÃO</span></span><br style=""box-sizing: border-box;""/>De 10 a 20% com água limpa</span></span></p><p style=""box-sizing: border-box; margin-top: 0px; margin-bottom: 1rem; text-align: justify;""><span style=""font-size: 14px;""><span style=""font-family: verdana, geneva, sans-serif;"">Antes de iniciar a pintura, mexa o produto novamente para que atinja o ponto ideal para aplicação e rendimento.</span></span></p><p style=""box-sizing: border-box; margin-top: 0px; margin-bottom: 1rem; text-align: justify;""> </p><p style=""box-sizing: border-box; margin-top: 0px; margin-bottom: 1rem; text-align: justify;""><span style=""font-size: 16px;""><span style=""font-family: verdana, geneva, sans-serif;""><span style=""box-sizing: border-box; font-weight: bolder;"">FERRAMENTAS</span></span></span></p><p style=""box-sizing: border-box; margin-top: 0px; margin-bottom: 1rem; text-align: justify;""><span style=""font-size: 14px;""><span style=""font-family: verdana, geneva, sans-serif;"">Rolo, pincel ou pistola.</span></span></p><p style=""box-sizing: border-box; margin-top: 0px; margin-bottom: 1rem; text-align: justify;""> </p><p style=""box-sizing: border-box; margin-top: 0px; margin-bottom: 1rem; text-align: justify;""><span style=""font-size: 16px;""><span style=""font-family: verdana, geneva, sans-serif;""><span style=""box-sizing: border-box; font-weight: bolder;"">CAMADAS</span></span></span></p><p style=""box-sizing: border-box; margin-top: 0px; margin-bottom: 1rem; text-align: justify;""><span style=""font-size: 14px;""><span style=""font-family: verdana, geneva, sans-serif;"">Recomendamos a pintura em 2 camadas, respeitando o tempo de 4 horas entre camadas. Dependendo das condições da superfície pode haver necessidade de uma camada adicional.</span></span></p><p style=""box-sizing: border-box; margin-top: 0px; margin-bottom: 1rem; text-align: justify;""><span style=""font-size: 14px;""><span style=""font-family: verdana, geneva, sans-serif;""><span style=""box-sizing: border-box; font-weight: bolder;""> </span></span></span></p><p style=""box-sizing: border-box; margin-top: 0px; margin-bottom: 1rem; text-align: justify;""><span style=""font-size: 16px;""><span style=""font-family: verdana, geneva, sans-serif;""><span style=""box-sizing: border-box; font-weight: bolder;"">RENDIMENTO</span></span></span></p><p style=""box-sizing: border-box; margin-top: 0px; margin-bottom: 1rem; text-align: justify;""><span style=""font-size: 14px;""><span style=""font-family: verdana, geneva, sans-serif;"">900 mL: 7,5 a 10 m<span style=""box-sizing: border-box; position: relative; line-height: 0; vertical-align: baseline; top: -0.5em;"">2</span> / demão</span></span></p><p style=""box-sizing: border-box; margin-top: 0px; margin-bottom: 1rem; text-align: justify;""><span style=""font-size: 14px;""><span style=""font-family: verdana, geneva, sans-serif;"">3,6 L: 30 a 40 m<span style=""box-sizing: border-box; position: relative; line-height: 0; vertical-align: baseline; top: -0.5em;"">2</span> / demão</span></span></p><p style=""box-sizing: border-box; margin-top: 0px; margin-bottom: 1rem; text-align: justify;""><span style=""font-size: 14px;""><span style=""font-family: verdana, geneva, sans-serif;"">O rendimento pode sofrer alteração de acordo com a superfície, ferramenta utilizada e experiência do aplicador.</span></span></p><p style=""box-sizing: border-box; margin-top: 0px; margin-bottom: 1rem; text-align: justify;""> </p><p style=""box-sizing: border-box; margin-top: 0px; margin-bottom: 1rem; text-align: justify;""><span style=""font-size: 16px;""><span style=""font-family: verdana, geneva, sans-serif;""><span style=""box-sizing: border-box; font-weight: bolder;"">SECAGEM</span></span></span></p><p style=""box-sizing: border-box; margin-top: 0px; margin-bottom: 1rem; text-align: justify;""><span style=""font-size: 14px;""><span style=""font-family: verdana, geneva, sans-serif;"">1 hora ao toque, 4 horas entre demãos e 24 horas final. Este tempo pode variar de acordo com as condições climáticas locais no momento da aplicação.</span></span></p><p style=""box-sizing: border-box; margin-top: 0px; margin-bottom: 1rem; text-align: justify;""> </p></div>",https://images.tcdn.com.br/img/img_prod/1139809/fundo_nivelador_base_agua_fosco_cia_acqua_branco_ciacollor_3_6lt_4092_1_7d8e997189582a223640006f051820b6.png,
3885,"Esmalte Base Água Acetinado Ciacollor 0,9lt",53.01,http://www.mercotintas.com.br/linha-imobiliaria/esmalte-base-agua-acetinado-ciacollor-0-9lt,https://images.tcdn.com.br/img/img_prod/1139809/esmalte_base_agua_acetinado_ciacollor_0_9lt_3885_1_5bdd93c5c31faa54b045860a3dfa23ee.png,"<div class=""tab rte description-ab active"" id=""descricao""><p><span style=""font-size:14px;""><span style=""font-family:verdana,geneva,sans-serif;""><span style=""color:#000000;""><span style=""text-align: center;""><strong>Cia Acqua</strong> é um esmalte indicado para aplicação em superfícies de metais ferrosos, madeira, alumínio ou galvanizado em áreas externas e internas. Este produto segue classificação da norma NBR 11702 tipo 4.2.3.2.</span></span></span></span></p><p> </p><p style=""box-sizing: border-box; margin-top: 0px; margin-bottom: 1rem;""><span style=""font-size:14px;""><span style=""font-family:verdana,geneva,sans-serif;""><strong><span style=""box-sizing: border-box; font-weight: bolder;"">PREPARAÇÃO DA SUPERFÍCIE / INSTRUÇÕES DE USO</span></strong></span></span></p><p style=""box-sizing: border-box; margin-top: 0px; margin-bottom: 1rem;""><span style=""font-size:14px;""><span style=""font-family:verdana,geneva,sans-serif;""><strong>Madeira Nova:</strong> eliminar as farpas, retirando a poeira com um pano úmido. Aplicar de uma demão de Fundo Sintético Nivelador Ciacollor. Em caso de imperfeições, corrigir com Massa para Madeira. Nivelar porosidade com mais uma demão de Fundo Sintético Nivelador Ciacollor e em seguida aplicar o Esmalte Base de Água Ciacollor.</span></span></p><p style=""box-sizing: border-box; margin-top: 0px; margin-bottom: 1rem;""><span style=""font-size:14px;""><span style=""font-family:verdana,geneva,sans-serif;""><strong>Superfícies de ferro ou aço:</strong> eliminar possíveis pontos de ferrugem ou qualquer outra impureza. Limpar a superfície com um pano seco embebido em thinner ou aguarráz. Aplicar uma demão de Zarcão Ciacollor. Após secagem do zarcão, aplicar o Esmalte Base Água Ciacollor.<br style=""box-sizing: border-box;""/><br style=""box-sizing: border-box;""/><strong>Superfícies galvanizadas ou de alumínio:</strong> Limpar com um pano úmido e aguardar a secagem. Aplicar uma demão de fundo para galvanizado. Aguardar secagem do fundo e depois aplicar o esmalte.<br style=""box-sizing: border-box;""/><br style=""box-sizing: border-box;""/><strong>OBS:</strong> em caso de repintura, certificar que não haja brilho na superfície e apenas depois aplicar o esmalte. Se houver brilho, eliminar com lixa adequada. A não observância deste processo pode acarretar problemas de baixo brilho e aderência.</span></span></p><p style=""box-sizing: border-box; margin-top: 0px; margin-bottom: 1rem;""> </p><p style=""box-sizing: border-box; margin-top: 0px; margin-bottom: 1rem;""><span style=""font-size:16px;""><span style=""font-family:verdana,geneva,sans-serif;""><span style=""box-sizing: border-box; font-weight: bolder;"">PREPARAÇÃO DO PRODUTO</span></span></span></p><p style=""box-sizing: border-box; margin-top: 0px; margin-bottom: 1rem;""><span style=""font-size:14px;""><span style=""font-family:verdana,geneva,sans-serif;"">Assim que abrir a embalagem, mexa o produto com uma espátula/régua ou similar para que este se torne homogêneo.</span></span></p><p style=""box-sizing: border-box; margin-top: 0px; margin-bottom: 1rem;""> </p><p style=""box-sizing: border-box; margin-top: 0px; margin-bottom: 1rem;""><span style=""font-size:14px;""><span style=""font-family:verdana,geneva,sans-serif;""><span style=""font-size:16px;""><span style=""box-sizing: border-box; font-weight: bolder;"">DILUIÇÃO</span></span><br style=""box-sizing: border-box;""/>Pistola: diluir até 30% com água limpa</span></span></p><p style=""box-sizing: border-box; margin-top: 0px; margin-bottom: 1rem;""><span style=""font-size:14px;""><span style=""font-family:verdana,geneva,sans-serif;"">Pincel, trincha ou rolo: diluir até 10% com água limpa<br style=""box-sizing: border-box;""/>Antes de iniciar a pintura, mexa o produto novamente para que atinja o ponto ideal para aplicação e rendimento.</span></span></p><p style=""box-sizing: border-box; margin-top: 0px; margin-bottom: 1rem;""> </p><p style=""box-sizing: border-box; margin-top: 0px; margin-bottom: 1rem;""><span style=""font-size:16px;""><span style=""font-family:verdana,geneva,sans-serif;""><span style=""box-sizing: border-box; font-weight: bolder;"">FERRAMENTAS</span></span></span></p><p style=""box-sizing: border-box; margin-top: 0px; margin-bottom: 1rem;""><span style=""font-size:14px;""><span style=""font-family:verdana,geneva,sans-serif;"">Rolo de lã de pêlo baixo, trincha, pistola ou pincel de cerdas macias.</span></span></p><p style=""box-sizing: border-box; margin-top: 0px; margin-bottom: 1rem;""> </p><p style=""box-sizing: border-box; margin-top: 0px; margin-bottom: 1rem;""><span style=""font-size:16px;""><span style=""font-family:verdana,geneva,sans-serif;""><span style=""box-sizing: border-box; font-weight: bolder;"">CAMADAS</span></span></span></p><p style=""box-sizing: border-box; margin-top: 0px; margin-bottom: 1rem;""><span style=""font-size:14px;""><span style=""font-family:verdana,geneva,sans-serif;"">Recomendamos a pintura em 2 camadas, respeitando o tempo de 4 horas entre camadas. Dependendo das condições da superfície pode haver necessidade de uma camada adicional.</span></span></p><p style=""box-sizing: border-box; margin-top: 0px; margin-bottom: 1rem;""> </p><p style=""box-sizing: border-box; margin-top: 0px; margin-bottom: 1rem;""><span style=""font-size:16px;""><span style=""font-family:verdana,geneva,sans-serif;""><span style=""box-sizing: border-box; font-weight: bolder;"">RENDIMENTO</span></span></span></p><p style=""box-sizing: border-box; margin-top: 0px; margin-bottom: 1rem;""><span style=""font-size:14px;""><span style=""font-family:verdana,geneva,sans-serif;"">900 mL ou 810 mL: 9 a 11 m<span style=""box-sizing: border-box; position: relative; line-height: 0; vertical-align: baseline; top: -0.5em;"">2</span> / demão</span></span></p><p style=""box-sizing: border-box; margin-top: 0px; margin-bottom: 1rem;""><span style=""font-size:14px;""><span style=""font-family:verdana,geneva,sans-serif;"">Galão 3,6 L ou 3,24 L: 35 a 45 m² / demão</span></span></p><p style=""box-sizing: border-box; margin-top: 0px; margin-bottom: 1rem;""> </p><p style=""box-sizing: border-box; margin-top: 0px; margin-bottom: 1rem;""><span style=""font-size:14px;""><span style=""font-family:verdana,geneva,sans-serif;"">*O rendimento pode sofrer alteração de acordo com a superfície, ferramenta utilizada e experiência do aplicador.</span></span></p><p style=""box-sizing: border-box; margin-top: 0px; margin-bottom: 1rem;""> </p><p style=""box-sizing: border-box; margin-top: 0px; margin-bottom: 1rem;""><span style=""font-size:16px;""><span style=""font-family:verdana,geneva,sans-serif;""><span style=""box-sizing: border-box; font-weight: bolder;"">SECAGEM</span></span></span></p><p style=""box-sizing: border-box; margin-top: 0px; margin-bottom: 1rem;""><span style=""font-size:14px;""><span style=""font-family:verdana,geneva,sans-serif;"">30 minutos ao toque, 4 horas entre demãos e 7 dias. Este tempo pode variar de acordo com as condições climáticas locais no momento da aplicação.</span></span></p><p style=""box-sizing: border-box; margin-top: 0px; margin-bottom: 1rem;""> </p></div>",https://images.tcdn.com.br/img/img_prod/1139809/esmalte_base_agua_acetinado_ciacollor_0_9lt_3885_2_9a962f9b6e2f34f5591bd7640f4dd2af.png | https://images.tcdn.com.br/img/img_prod/1139809/90_esmalte_base_agua_acetinado_ciacollor_0_9lt_3885_1_5bdd93c5c31faa54b045860a3dfa23ee.png | https://images.tcdn.com.br/img/img_prod/1139809/esmalte_base_agua_acetinado_ciacollor_0_9lt_3885_1_5bdd93c5c31faa54b045860a3dfa23ee.png | https://images.tcdn.com.br/img/img_prod/1139809/90_esmalte_base_agua_acetinado_ciacollor_0_9lt_3885_3_db8d50927c6af8c5022e4d245fe067aa.png | https://images.tcdn.com.br/img/img_prod/1139809/esmalte_base_agua_acetinado_ciacollor_0_9lt_3885_3_db8d50927c6af8c5022e4d245fe067aa.png | https://images.tcdn.com.br/img/img_prod/1139809/90_esmalte_base_agua_acetinado_ciacollor_0_9lt_3885_2_9a962f9b6e2f34f5591bd7640f4dd2af.png,Cor: Branco Neve [R$53.01] (Stock:SI)
3843,"Esmalte Base Água Fosco Ciacollor 0,9lt",51.47,http://www.mercotintas.com.br/linha-imobiliaria/esmalte-base-agua-fosco-ciacollor-0-9lt,https://images.tcdn.com.br/img/img_prod/1139809/esmalte_base_agua_fosco_ciacollor_0_9lt_3843_1_5bdd93c5c31faa54b045860a3dfa23ee.png,"<div class=""tab rte description-ab active"" id=""descricao""><p><span style=""font-size: 14px;""><span style=""font-family: verdana, geneva, sans-serif;""><span style=""color: rgb(0, 0, 0);""><span style=""text-align: center;""><strong>Cia Acqua</strong> é um esmalte indicado para aplicação em superfícies de metais ferrosos, madeira, alumínio ou galvanizado em áreas externas e internas. Este produto segue classificação da norma NBR 11702 tipo 4.2.3.2.</span></span></span></span></p><p> </p><p style=""box-sizing: border-box; margin-top: 0px; margin-bottom: 1rem;""><span style=""font-size: 14px;""><span style=""font-family: verdana, geneva, sans-serif;""><strong><span style=""box-sizing: border-box; font-weight: bolder;"">PREPARAÇÃO DA SUPERFÍCIE / INSTRUÇÕES DE USO</span></strong></span></span></p><p style=""box-sizing: border-box; margin-top: 0px; margin-bottom: 1rem;""><span style=""font-size: 14px;""><span style=""font-family: verdana, geneva, sans-serif;""><strong>Madeira Nova:</strong> eliminar as farpas, retirando a poeira com um pano úmido. Aplicar de uma demão de Fundo Sintético Nivelador Ciacollor. Em caso de imperfeições, corrigir com Massa para Madeira. Nivelar porosidade com mais uma demão de Fundo Sintético Nivelador Ciacollor e em seguida aplicar o Esmalte Base de Água Ciacollor.</span></span></p><p style=""box-sizing: border-box; margin-top: 0px; margin-bottom: 1rem;""><span style=""font-size: 14px;""><span style=""font-family: verdana, geneva, sans-serif;""><strong>Superfícies de ferro ou aço:</strong> eliminar possíveis pontos de ferrugem ou qualquer outra impureza. Limpar a superfície com um pano seco embebido em thinner ou aguarráz. Aplicar uma demão de Zarcão Ciacollor. Após secagem do zarcão, aplicar o Esmalte Base Água Ciacollor.<br style=""box-sizing: border-box;""/><br style=""box-sizing: border-box;""/><strong>Superfícies galvanizadas ou de alumínio:</strong> Limpar com um pano úmido e aguardar a secagem. Aplicar uma demão de fundo para galvanizado. Aguardar secagem do fundo e depois aplicar o esmalte.<br style=""box-sizing: border-box;""/><br style=""box-sizing: border-box;""/><strong>OBS:</strong> em caso de repintura, certificar que não haja brilho na superfície e apenas depois aplicar o esmalte. Se houver brilho, eliminar com lixa adequada. A não observância deste processo pode acarretar problemas de baixo brilho e aderência.</span></span></p><p style=""box-sizing: border-box; margin-top: 0px; margin-bottom: 1rem;""> </p><p style=""box-sizing: border-box; margin-top: 0px; margin-bottom: 1rem;""><span style=""font-size: 16px;""><span style=""font-family: verdana, geneva, sans-serif;""><span style=""box-sizing: border-box; font-weight: bolder;"">PREPARAÇÃO DO PRODUTO</span></span></span></p><p style=""box-sizing: border-box; margin-top: 0px; margin-bottom: 1rem;""><span style=""font-size: 14px;""><span style=""font-family: verdana, geneva, sans-serif;"">Assim que abrir a embalagem, mexa o produto com uma espátula/régua ou similar para que este se torne homogêneo.</span></span></p><p style=""box-sizing: border-box; margin-top: 0px; margin-bottom: 1rem;""> </p><p style=""box-sizing: border-box; margin-top: 0px; margin-bottom: 1rem;""><span style=""font-size: 14px;""><span style=""font-family: verdana, geneva, sans-serif;""><span style=""font-size: 16px;""><span style=""box-sizing: border-box; font-weight: bolder;"">DILUIÇÃO</span></span><br style=""box-sizing: border-box;""/>Pistola: diluir até 30% com água limpa</span></span></p><p style=""box-sizing: border-box; margin-top: 0px; margin-bottom: 1rem;""><span style=""font-size: 14px;""><span style=""font-family: verdana, geneva, sans-serif;"">Pincel, trincha ou rolo: diluir até 10% com água limpa<br style=""box-sizing: border-box;""/>Antes de iniciar a pintura, mexa o produto novamente para que atinja o ponto ideal para aplicação e rendimento.</span></span></p><p style=""box-sizing: border-box; margin-top: 0px; margin-bottom: 1rem;""> </p><p style=""box-sizing: border-box; margin-top: 0px; margin-bottom: 1rem;""><span style=""font-size: 16px;""><span style=""font-family: verdana, geneva, sans-serif;""><span style=""box-sizing: border-box; font-weight: bolder;"">FERRAMENTAS</span></span></span></p><p style=""box-sizing: border-box; margin-top: 0px; margin-bottom: 1rem;""><span style=""font-size: 14px;""><span style=""font-family: verdana, geneva, sans-serif;"">Rolo de lã de pêlo baixo, trincha, pistola ou pincel de cerdas macias.</span></span></p><p style=""box-sizing: border-box; margin-top: 0px; margin-bottom: 1rem;""> </p><p style=""box-sizing: border-box; margin-top: 0px; margin-bottom: 1rem;""><span style=""font-size: 16px;""><span style=""font-family: verdana, geneva, sans-serif;""><span style=""box-sizing: border-box; font-weight: bolder;"">CAMADAS</span></span></span></p><p style=""box-sizing: border-box; margin-top: 0px; margin-bottom: 1rem;""><span style=""font-size: 14px;""><span style=""font-family: verdana, geneva, sans-serif;"">Recomendamos a pintura em 2 camadas, respeitando o tempo de 4 horas entre camadas. Dependendo das condições da superfície pode haver necessidade de uma camada adicional.</span></span></p><p style=""box-sizing: border-box; margin-top: 0px; margin-bottom: 1rem;""> </p><p style=""box-sizing: border-box; margin-top: 0px; margin-bottom: 1rem;""><span style=""font-size: 16px;""><span style=""font-family: verdana, geneva, sans-serif;""><span style=""box-sizing: border-box; font-weight: bolder;"">RENDIMENTO</span></span></span></p><p style=""box-sizing: border-box; margin-top: 0px; margin-bottom: 1rem;""><span style=""font-size: 14px;""><span style=""font-family: verdana, geneva, sans-serif;"">900 mL ou 810 mL: 9 a 11 m<span style=""box-sizing: border-box; position: relative; line-height: 0; vertical-align: baseline; top: -0.5em;"">2</span> / demão</span></span></p><p style=""box-sizing: border-box; margin-top: 0px; margin-bottom: 1rem;""><span style=""font-size: 14px;""><span style=""font-family: verdana, geneva, sans-serif;"">Galão 3,6 L ou 3,24 L: 35 a 45 m² / demão</span></span></p><p style=""box-sizing: border-box; margin-top: 0px; margin-bottom: 1rem;""> </p><p style=""box-sizing: border-box; margin-top: 0px; margin-bottom: 1rem;""><span style=""font-size: 14px;""><span style=""font-family: verdana, geneva, sans-serif;"">*O rendimento pode sofrer alteração de acordo com a superfície, ferramenta utilizada e experiência do aplicador.</span></span></p><p style=""box-sizing: border-box; margin-top: 0px; margin-bottom: 1rem;""> </p><p style=""box-sizing: border-box; margin-top: 0px; margin-bottom: 1rem;""><span style=""font-size: 16px;""><span style=""font-family: verdana, geneva, sans-serif;""><span style=""box-sizing: border-box; font-weight: bolder;"">SECAGEM</span></span></span></p><p style=""box-sizing: border-box; margin-top: 0px; margin-bottom: 1rem;""><span style=""font-size: 14px;""><span style=""font-family: verdana, geneva, sans-serif;"">30 minutos ao toque, 4 horas entre demãos e 7 dias. Este tempo pode variar de acordo com as condições climáticas locais no momento da aplicação.</span></span></p><p style=""box-sizing: border-box; margin-top: 0px; margin-bottom: 1rem;""> </p></div>",https://images.tcdn.com.br/img/img_prod/1139809/esmalte_base_agua_fosco_ciacollor_0_9lt_3843_1_5bdd93c5c31faa54b045860a3dfa23ee.png | https://images.tcdn.com.br/img/img_prod/1139809/esmalte_base_agua_fosco_ciacollor_0_9lt_3843_2_9a962f9b6e2f34f5591bd7640f4dd2af.png | https://images.tcdn.com.br/img/img_prod/1139809/90_esmalte_base_agua_fosco_ciacollor_0_9lt_3843_3_db8d50927c6af8c5022e4d245fe067aa.png | https://images.tcdn.com.br/img/img_prod/1139809/esmalte_base_agua_fosco_ciacollor_0_9lt_3843_3_db8d50927c6af8c5022e4d245fe067aa.png | https://images.tcdn.com.br/img/img_prod/1139809/90_esmalte_base_agua_fosco_ciacollor_0_9lt_3843_2_9a962f9b6e2f34f5591bd7640f4dd2af.png | https://images.tcdn.com.br/img/img_prod/1139809/90_esmalte_base_agua_fosco_ciacollor_0_9lt_3843_1_5bdd93c5c31faa54b045860a3dfa23ee.png,Cor: Branco Neve [R$51.47] (Stock:SI) | Cor: Preto [R$53.01] (Stock:SI)
